A1: Official League Standings | K1: As of week | L1: 26
A3: Team | B3: W | C3: L | D3: GB | E3: Pct. | F3: RS | G3: RA | H3: ARA | I3: IP | J3: Payroll | K3: Cap | L3: Revenue | M3: Prize | N3: Balance
A4: Arsenal | B4: =(F4^2/(F4^2+G4^2))*($L$1*6.2307) -> 112.4903156258348 | C4: =$L$1*6.2307-B4 -> 49.507884374165201 | D4: =$B$4-B4 -> 0.0 | E4: =B4/(B4+C4) -> 0.69439237982789193 | F4: 1027.6 | G4: =$F$25/I4*H4 -> 681.71635291725954 | H4: 690 | I4: 1475.7 | J4: 136.1 | K4: 127.5 | L4: =($J$23-272)*B4/$B$23 -> 129.34292077479873 | M4: 200 | N4: =L4+M4-J4 -> 193.2429207747987
A5: Philadelphia Bulldogs | B5: =(F5^2/(F5^2+G5^2))*($L$1*6.2307) -> 110.31335790353262 | C5: =$L$1*6.2307-B5 -> 51.684842096467378 | D5: =$B$4-B5 -> 2.176957722302177 | E5: =B5/(B5+C5) -> 0.68095421988350868 | F5: 1044.7 | G5: =$F$25/I5*H5 -> 715.08742234332431 | H5: 720 | I5: 1468.0 | J5: 128.75 | K5: 129 | L5: =($J$23-272)*B5/$B$23 -> 126.83982467590974 | M5: 60 | N5: =L5+M5-J5 -> 58.089824675909739
A6: North Bethesda Lindy Hoppers | B6: =(F6^2/(F6^2+G6^2))*($L$1*6.2307) -> 104.85617533413065 | C6: =$L$1*6.2307-B6 -> 57.142024665869343 | D6: =$B$4-B6 -> 7.6341402917041421 | E6: =B6/(B6+C6) -> 0.64726753343019028 | F6: 1014.7 | G6: =$F$25/I6*H6 -> 749.06320803443327 | H6: 752 | I6: 1463.7 | J6: 151.1 | K6: 151.7 | L6: =($J$23-272)*B6/$B$23 -> 120.56508067860813 | M6: 12 | N6: =L6+M6-J6 -> -18.534919321391868
A7: Diamond Dohyo Demigods | B7: =(F7^2/(F7^2+G7^2))*($L$1*6.2307) -> 98.634088794527258 | C7: =$L$1*6.2307-B7 -> 63.364111205472739 | D7: =$B$4-B7 -> 13.856226831307538 | E7: =B7/(B7+C7) -> 0.60885916506805171 | F7: 893.2 | G7: =$F$25/I7*H7 -> 715.90742999999998 | H7: 766 | I7: 1560.0 | J7: 121.15 | K7: 124.5 | L7: =($J$23-272)*B7/$B$23 -> 113.41083951688242 | N7: =L7+M7-J7 -> -7.7391604831175869
A8: Edmonton Trappers | B8: =(F8^2/(F8^2+G8^2))*($L$1*6.2307) -> 97.751969483482569 | C8: =$L$1*6.2307-B8 -> 64.246230516517429 | D8: =$B$4-B8 -> 14.738346142352228 | E8: =B8/(B8+C8) -> 0.60341392363299451 | F8: 916.1 | G8: =$F$25-I8+H8 -> 742.68380000000002 | H8: 683 | I8: 1398.3 | J8: 119.8 | K8: 120 | L8: =($J$23-272)*B8/$B$23 -> 112.39656653233611 | N8: =L8+M8-J8 -> -7.4034334676638878
A9: The Natural | B9: =(F9^2/(F9^2+G9^2))*($L$1*6.2307) -> 94.910437100042344 | C9: =$L$1*6.2307-B9 -> 67.087762899957653 | D9: =$B$4-B9 -> 17.579878525792452 | E9: =B9/(B9+C9) -> 0.58587340538377797 | F9: 836.5 | G9: =$F$25-I9+H9 -> 703.28379999999993 | H9: 642 | I9: 1396.7 | J9: 125.1 | K9: 120 | L9: =($J$23-272)*B9/$B$23 -> 109.12933329625186 | N9: =L9+M9-J9 -> -15.970666703748137
A10: Atonic Spiloman | B10: =(F10^2/(F10^2+G10^2))*($L$1*6.2307) -> 93.041246806290317 | C10: =$L$1*6.2307-B10 -> 68.95695319370968 | D10: =$B$4-B10 -> 19.449068819544479 | E10: =B10/(B10+C10) -> 0.5743350654901741 | F10: 815 | G10: =$F$25/I10*H10 -> 701.63117932084458 | H10: 727 | I10: 1510.7 | J10: 119.8 | K10: 128.5 | L10: =($J$23-272)*B10/$B$23 -> 106.98011244348126 | N10: =L10+M10-J10 -> -12.819887556518736
A11: Bloomington Angels | B11: =(F11^2/(F11^2+G11^2))*($L$1*6.2307) -> 91.972814100812215 | C11: =$L$1*6.2307-B11 -> 70.025385899187782 | D11: =$B$4-B11 -> 20.517501525022581 | E11: =B11/(B11+C11) -> 0.56773972859459065 | F11: 802.6 | G11: =$F$25/I11*H11 -> 700.3210386847195 | H11: 745 | I11: 1551.0 | J11: 134.9 | K11: 130 | L11: =($J$23-272)*B11/$B$23 -> 105.75161374109055 | N11: =L11+M11-J11 -> -29.148386258909454
A12: The Mayhem 5 | B12: =(F12^2/(F12^2+G12^2))*($L$1*6.2307) -> 88.853913445302211 | C12: =$L$1*6.2307-B12 -> 73.144286554697786 | D12: =$B$4-B12 -> 23.636402180532585 | E12: =B12/(B12+C12) -> 0.54848704149368455 | F12: 822.2 | G12: =$F$25-I12+H12 -> 745.98379999999997 | H12: 739 | I12: 1451.0 | J12: 93.7 | K12: 111 | L12: =($J$23-272)*B12/$B$23 -> 102.16545862946376 | N12: =L12+M12-J12 -> 8.4654586294637539
A13: Burrito Benders | B13: =(F13^2/(F13^2+G13^2))*($L$1*6.2307) -> 85.995233218912205 | C13: =$L$1*6.2307-B13 -> 76.002966781087792 | D13: =$B$4-B13 -> 26.495082406922592 | E13: =B13/(B13+C13) -> 0.53084067118592804 | F13: 806.7 | G13: =$F$25/I13*H13 -> 758.38570850061092 | H13: 894 | I13: 1718.7 | J13: 34.45 | K13: 53.8 | L13: =($J$23-272)*B13/$B$23 -> 98.878508566381825 | N13: =L13+M13-J13 -> 64.428508566381822
A14: Alexandria Fire | B14: =(F14^2/(F14^2+G14^2))*($L$1*6.2307) -> 85.153952058837419 | C14: =$L$1*6.2307-B14 -> 76.844247941162578 | D14: =$B$4-B14 -> 27.336363566997377 | E14: =B14/(B14+C14) -> 0.52564751990353853 | F14: 827.8 | G14: =$F$25/I14*H14 -> 786.37319260780282 | H14: 788 | I14: 1461.0 | J14: 96.6 | K14: 120 | L14: =($J$23-272)*B14/$B$23 -> 97.911191852658476 | N14: =L14+M14-J14 -> 1.3111918526584816
A15: Motor City Kitties | B15: =(F15^2/(F15^2+G15^2))*($L$1*6.2307) -> 77.428947952726588 | C15: =$L$1*6.2307-B15 -> 84.569252047273409 | D15: =$B$4-B15 -> 35.061367673108208 | E15: =B15/(B15+C15) -> 0.47796177953043051 | F15: 747 | G15: =$F$25-I15+H15 -> 780.68380000000002 | H15: 719 | I15: 1396.3 | J15: 117.45 | K15: 120 | L15: =($J$23-272)*B15/$B$23 -> 89.028875285913813 | N15: =L15+M15-J15 -> -28.42112471408619
A16: LB Cats | B16: =(F16^2/(F16^2+G16^2))*($L$1*6.2307) -> 77.233451226576648 | C16: =$L$1*6.2307-B16 -> 84.764748773423349 | D16: =$B$4-B16 -> 35.256864399258149 | E16: =B16/(B16+C16) -> 0.47675499620722112 | F16: 770.3 | G16: =$F$25-I16+H16 -> 806.98379999999997 | H16: 695 | I16: 1346.0 | J16: 117.1 | K16: 120 | L16: =($J$23-272)*B16/$B$23 -> 88.804090446245922 | N16: =L16+M16-J16 -> -28.295909553754072
A17: Hotel Illness | B17: =(F17^2/(F17^2+G17^2))*($L$1*6.2307) -> 75.395498618230974 | C17: =$L$1*6.2307-B17 -> 86.602701381769023 | D17: =$B$4-B17 -> 37.094817007603822 | E17: =B17/(B17+C17) -> 0.4654094836747012 | F17: 841.6 | G17: =$F$25-I17+H17 -> 901.98379999999997 | H17: 810 | I17: 1366.0 | J17: 119.15 | K17: 120 | L17: =($J$23-272)*B17/$B$23 -> 86.690787116208043 | N17: =L17+M17-J17 -> -32.459212883791963
A18: Bears | B18: =(F18^2/(F18^2+G18^2))*($L$1*6.2307) -> 68.133721936324406 | C18: =$L$1*6.2307-B18 -> 93.864478063675591 | D18: =$B$4-B18 -> 44.35659368951039 | E18: =B18/(B18+C18) -> 0.42058320361784518 | F18: 672.2 | G18: =$F$25-I18+H18 -> 788.98379999999997 | H18: 766 | I18: 1435.0 | J18: 119.85 | K18: 120 | L18: =($J$23-272)*B18/$B$23 -> 78.341095848772312 | N18: =L18+M18-J18 -> -41.508904151227682
A19: Kitty O’Sheas | B19: =(F19^2/(F19^2+G19^2))*($L$1*6.2307) -> 67.83762607041605 | C19: =$L$1*6.2307-B19 -> 94.160573929583947 | D19: =$B$4-B19 -> 44.652689555418746 | E19: =B19/(B19+C19) -> 0.41875543105056756 | F19: 794.2 | G19: =$F$25-I19+H19 -> 935.68380000000002 | H19: 725 | I19: 1247.3 | J19: 120.15 | K19: 124 | L19: =($J$23-272)*B19/$B$23 -> 78.000640726810374 | N19: =L19+M19-J19 -> -42.149359273189631
A20: Culver City Crush | B20: =(F20^2/(F20^2+G20^2))*($L$1*6.2307) -> 67.719783838907617 | C20: =$L$1*6.2307-B20 -> 94.27841616109238 | D20: =$B$4-B20 -> 44.770531786927179 | E20: =B20/(B20+C20) -> 0.41802800178586935 | F20: 704.7 | G20: =$F$25/I20*H20 -> 831.48157280902637 | H20: 1021 | I20: 1790.3 | J20: 91.35 | K20: 120 | L20: =($J$23-272)*B20/$B$23 -> 77.865144099130717 | N20: =L20+M20-J20 -> -13.484855900869277
A21: Harry’s Budmen | B21: =(F21^2/(F21^2+G21^2))*($L$1*6.2307) -> 62.356108291526304 | C21: =$L$1*6.2307-B21 -> 99.642091708473686 | D21: =$B$4-B21 -> 50.134207334308492 | E21: =B21/(B21+C21) -> 0.38491852558563183 | F21: 708 | G21: =$F$25-I21+H21 -> 894.98379999999997 | H21: 522 | I21: 1085.0 | J21: 119.3 | K21: 120 | L21: =($J$23-272)*B21/$B$23 -> 71.697915769056266 | N21: =L21+M21-J21 -> -47.602084230943731
A23: Totals | B23: =SUM(B4:B21) -> 1560.0786418064131 | C23: =SUM(C4:C21) -> 1355.8889581935869 | J23: =SUM(J4:J21) -> 2065.8 | K23: =SUM(K4:K21)-(120*18) -> 0 | L23: =SUM(L4:L21) -> 1793.8 | M23: 272 | N23: =SUM(N4:N21) -> 2.7000623958883807E-13
A25: Current innings pitched requirement: | F25: =$L$1*9*6.2307 -> 1457.9838
A27: Definitions:
A28: ARA: Actual Runs Allowed by your fantasy staff
A29: RA: IPRequired-IP+Actual RA (teams below IP requirement)
A30: IPRequired/IP*Actual RA (teams above IP requirement)
A32: Fees added to payrolls:
A33: Bears $1.50 preseason drops
A34: Natural $8.05 preseason drops
A35: Bloomington $17.05 preseason drops
A36: Lindys $.90 preseason drops
A37: Budmen $2.40 preseason drops
A38: Arsenal $8.70 preseason drops + $.90
A39: Kittys $1.05