A1: Official League Standings | J1: As of week | K1: 26
A3: Team | B3: W | C3: L | D3: GB | E3: RS | F3: RA | G3: ARA | H3: IP | I3: Payroll | J3: Cap | K3: Revenue | L3: Prize | M3: Balance
A4: Arsenal | B4: =(E4^2/(E4^2+F4^2))*($K$1*6.2307) -> 116.70106198183933 | C4: =$K$1*6.2307-B4 -> 45.297138018160666 | D4: =$B$4-B4 -> 0.0 | E4: 1006 | F4: =G4/H4*$E$25 -> 626.75233150684926 | G4: 659 | H4: 1533.0 | I4: 121.1 | J4: 123.5 | K4: =($I$23-232)*B4/$B$23 -> 132.37296785523128 | L4: 170 | M4: =K4+L4-I4 -> 181.27296785523131
A5: Philadelphia Bulldogs | B5: =(E5^2/(E5^2+F5^2))*($K$1*6.2307) -> 111.23784275093234 | C5: =$K$1*6.2307-B5 -> 50.760357249067653 | D5: =$B$4-B5 -> 5.4632192309069865 | E5: 920.4 | F5: =G5/H5*$E$25 -> 621.74552197018795 | G5: 658 | H5: 1543.0 | I5: 122.75 | J5: 124 | K5: =($I$23-232)*B5/$B$23 -> 126.17608728398616 | L5: 50 | M5: =K5+L5-I5 -> 53.426087283986163
A6: Atonic Spiloman | B6: =(E6^2/(E6^2+F6^2))*($K$1*6.2307) -> 99.886145589360495 | C6: =$K$1*6.2307-B6 -> 62.112054410639502 | D6: =$B$4-B6 -> 16.814916392478835 | E6: 950.2 | F6: =G6/H6*$E$25 -> 749.29070593220331 | G6: 849 | H6: 1652.0 | I6: 117.35 | J6: 120 | K6: =($I$23-232)*B6/$B$23 -> 113.29995901272066 | L6: 12 | M6: =K6+L6-I6 -> 7.9499590127206687
A7: Hotel Illness | B7: =(E7^2/(E7^2+F7^2))*($K$1*6.2307) -> 93.180395964169946 | C7: =$K$1*6.2307-B7 -> 68.817804035830051 | D7: =$B$4-B7 -> 23.520666017669384 | E7: 967.3 | F7: =($K$1*6.2307*9-H7)+G7 -> 831.28379999999993 | G7: 775 | H7: 1401.7 | I7: 120.95 | J7: 121.6 | K7: =($I$23-232)*B7/$B$23 -> 105.6936873601224 | M7: =K7+L7-I7 -> -15.256312639877606
A8: Whiffers | B8: =(E8^2/(E8^2+F8^2))*($K$1*6.2307) -> 93.046174178853477 | C8: =$K$1*6.2307-B8 -> 68.95202582114652 | D8: =$B$4-B8 -> 23.654887802985854 | E8: 907.6 | F8: =G8/H8*$E$25 -> 781.30165094512745 | G8: 876 | H8: 1634.7 | I8: 113.25 | J8: 120 | K8: =($I$23-232)*B8/$B$23 -> 105.5414407929409 | M8: =K8+L8-I8 -> -7.7085592070590963
A9: Jake's Chargers | B9: =(E9^2/(E9^2+F9^2))*($K$1*6.2307) -> 91.450703120065469 | C9: =$K$1*6.2307-B9 -> 70.547496879934528 | D9: =$B$4-B9 -> 25.250358861773861 | E9: 707.3 | F9: =G9/H9*$E$25 -> 621.22787999999991 | G9: 686 | H9: 1610.0 | I9: 119.75 | J9: 120 | K9: =($I$23-232)*B9/$B$23 -> 103.73171228154345 | M9: =K9+L9-I9 -> -16.018287718456548
A10: The Paper Clips | B10: =(E10^2/(E10^2+F10^2))*($K$1*6.2307) -> 90.278789818183043 | C10: =$K$1*6.2307-B10 -> 71.719410181816954 | D10: =$B$4-B10 -> 26.422272163656288 | E10: 895.3 | F10: =($K$1*6.2307*9-H10)+G10 -> 797.98379999999997 | G10: 692 | H10: 1352.0 | I10: 119.5 | J10: 120 | K10: =($I$23-232)*B10/$B$23 -> 102.40242153470054 | M10: =K10+L10-I10 -> -17.097578465299463
A11: Field of Schemes | B11: =(E11^2/(E11^2+F11^2))*($K$1*6.2307) -> 88.218688136294162 | C11: =$K$1*6.2307-B11 -> 73.779511863705835 | D11: =$B$4-B11 -> 28.482373845545169 | E11: 865.4 | F11: =G11/H11*$E$25 -> 791.41537290422048 | G11: 845 | H11: 1556.7 | I11: 118.75 | J11: 120 | K11: =($I$23-232)*B11/$B$23 -> 100.06566667502649 | M11: =K11+L11-I11 -> -18.684333324973508
A12: Falsetto | B12: =(E12^2/(E12^2+F12^2))*($K$1*6.2307) -> 86.128154387187692 | C12: =$K$1*6.2307-B12 -> 75.870045612812305 | D12: =$B$4-B12 -> 30.572907594651639 | E12: 732.7 | F12: =($K$1*6.2307*9-H12)+G12 -> 687.68380000000002 | G12: 612 | H12: 1382.3 | I12: 125.65 | J12: 134 | K12: =($I$23-232)*B12/$B$23 -> 97.694392994468117 | M12: =K12+L12-I12 -> -27.955607005531888
A13: Maryland Crabs | B13: =(E13^2/(E13^2+F13^2))*($K$1*6.2307) -> 85.767802953621597 | C13: =$K$1*6.2307-B13 -> 76.2303970463784 | D13: =$B$4-B13 -> 30.933259028217734 | E13: 798.7 | F13: =($K$1*6.2307*9-H13)+G13 -> 752.98379999999997 | G13: 673 | H13: 1378.0 | I13: 120 | J13: 120 | K13: =($I$23-232)*B13/$B$23 -> 97.285649595548122 | M13: =K13+L13-I13 -> -22.714350404451878
A14: LB Cats | B14: =(E14^2/(E14^2+F14^2))*($K$1*6.2307) -> 85.361483009066092 | C14: =$K$1*6.2307-B14 -> 76.636716990933905 | D14: =$B$4-B14 -> 31.339578972773239 | E14: 761 | F14: =G14/H14*$E$25 -> 721.06119989321235 | G14: 741 | H14: 1498.3 | I14: 117.3 | J14: 120.5 | K14: =($I$23-232)*B14/$B$23 -> 96.824764526927609 | M14: =K14+L14-I14 -> -20.475235473072388
A15: Wine & Cheese | B15: =(E15^2/(E15^2+F15^2))*($K$1*6.2307) -> 76.574275191658984 | C15: =$K$1*6.2307-B15 -> 85.423924808341013 | D15: =$B$4-B15 -> 40.126786790180347 | E15: 864.4 | F15: =($K$1*6.2307*9-H15)+G15 -> 912.98379999999997 | G15: 534 | H15: 1079.0 | I15: 118.7 | J15: 120 | K15: =($I$23-232)*B15/$B$23 -> 86.85751351654794 | M15: =K15+L15-I15 -> -31.842486483452063
A16: Strousberg Slugpuppets | B16: =(E16^2/(E16^2+F16^2))*($K$1*6.2307) -> 74.202180460096173 | C16: =$K$1*6.2307-B16 -> 87.796019539903824 | D16: =$B$4-B16 -> 42.498881521743158 | E16: 661.7 | F16: =G16/H16*$E$25 -> 719.76415443037979 | G16: 780 | H16: 1580.0 | I16: 83.7 | J16: 120 | K16: =($I$23-232)*B16/$B$23 -> 84.166867739052009 | M16: =K16+L16-I16 -> 0.46686773905200596
A17: Culver City Crush | B17: =(E17^2/(E17^2+F17^2))*($K$1*6.2307) -> 73.494106718492048 | C17: =$K$1*6.2307-B17 -> 88.504093281507949 | D17: =$B$4-B17 -> 43.206955263347282 | E17: 711.6 | F17: =G17/H17*$E$25 -> 780.89269497060752 | G17: 820 | H17: 1531.0 | I17: 114.4 | J17: 120 | K17: =($I$23-232)*B17/$B$23 -> 83.363706045021488 | M17: =K17+L17-I17 -> -31.036293954978518
A18: Kitty O'Sheas | B18: =(E18^2/(E18^2+F18^2))*($K$1*6.2307) -> 72.148932282001581 | C18: =$K$1*6.2307-B18 -> 89.849267717998416 | D18: =$B$4-B18 -> 44.552129699837749 | E18: 679.5 | F18: =($K$1*6.2307*9-H18)+G18 -> 758.28379999999993 | G18: 729 | H18: 1428.7 | I18: 92.25 | J18: 120 | K18: =($I$23-232)*B18/$B$23 -> 81.83788674725929 | M18: =K18+L18-I18 -> -10.41211325274071
A19: The Law | B19: =(E19^2/(E19^2+F19^2))*($K$1*6.2307) -> 64.748941960290878 | C19: =$K$1*6.2307-B19 -> 97.249258039709119 | D19: =$B$4-B19 -> 51.952120021548453 | E19: 685.4 | F19: =($K$1*6.2307*9-H19)+G19 -> 839.98379999999997 | G19: 698 | H19: 1316.0 | I19: 91.9 | J19: 112.5 | K19: =($I$23-232)*B19/$B$23 -> 73.444144099593672 | M19: =K19+L19-I19 -> -18.455855900406334
A20: Brooklyn Ballers | B20: =(E20^2/(E20^2+F20^2))*($K$1*6.2307) -> 63.854725206115432 | C20: =$K$1*6.2307-B20 -> 98.143474793884565 | D20: =$B$4-B20 -> 52.846336775723898 | E20: 638.6 | F20: =G20/H20*$E$25 -> 791.70449220035539 | G20: 825 | H20: 1519.3 | I20: 85.2 | J20: 115.9 | K20: =($I$23-232)*B20/$B$23 -> 72.429842056014181 | M20: =K20+L20-I20 -> -12.770157943985822
A21: Burrito Benders | B21: =(E21^2/(E21^2+F21^2))*($K$1*6.2307) -> 50.12936570474848 | C21: =$K$1*6.2307-B21 -> 111.86883429525152 | D21: =$B$4-B21 -> 66.571696277090851 | E21: 615.9 | F21: =G21/H21*$E$25 -> 920.06530839982941 | G21: 1036 | H21: 1641.7 | I21: 49.55 | J21: 108 | K21: =($I$23-232)*B21/$B$23 -> 56.861289883295527 | M21: =K21+L21-I21 -> 7.3112898832955295
A23: Totals | B23: =SUM(B4:B21) -> 1516.4097694129775 | C23: =SUM(C4:C21) -> 1399.5578305870224 | I23: =SUM(I4:I21) -> 1952.05 | J23: =SUM(J4:J21)-(120*18) -> 0 | K23: =SUM(K4:K21) -> 1720.05 | L23: 232 | M23: =SUM(M4:M21) -> -1.2789769243681803E-13
A25: Current innings pitched requirement: | E25: =$K$1*9*6.2307 -> 1457.9838
A27: Definitions:
A28: ARA: Actual Runs Allowed by your fantasy staff
A29: RA: IPRequired-IP+Actual RA (teams below IP requirement)
A30: TeamERA/9*IPRequired (teams above IP requirement)
A32: Notes: