A1: Official League Standings | H1: Through week | J1: 26
A3: Team | B3: W | C3: L | D3: GB | E3: RS | F3: Act. RA | G3: IP | H3: RA | I3: Payroll | J3: Revenue | K3: Prize | L3: Other | M3: Balance
A4: Whiffers | B4: =(E4^2/(E4^2+H4^2))*($J$1*6.2307) -> 102.66758774854667 | C4: =$J$1*6.2307-B4 -> 59.330612251453331 | D4: =$B$4-B4 -> 0.0 | E4: 860.2 | F4: 655 | G4: 1460.4 | H4: =F4/G4*$E$27 -> 653.91631676253076 | I4: 120 | J4: =($I$25-280)*B4/$B$25 -> 122.9842217601395 | K4: 200 | L4: -11 | M4: =J4+K4+L4-I4 -> 191.98422176013952
A5: The Paper Clips | B5: =(E5^2/(E5^2+H5^2))*($J$1*6.2307) -> 100.57154358784105 | C5: =$J$1*6.2307-B5 -> 61.426656412158948 | D5: =$B$4-B5 -> 2.0960441607056168 | E5: 840.9 | F5: 658 | G5: 1459.8 | H5: =F5/G5*$E$27 -> 657.18135388409371 | I5: 113.8 | J5: =($I$25-280)*B5/$B$25 -> 120.47339662503826 | K5: 60 | M5: =J5+K5+L5-I5 -> 66.673396625038279
A6: Greensboro Gorillas | B6: =(E6^2/(E6^2+H6^2))*($J$1*6.2307) -> 97.613753093409841 | C6: =$J$1*6.2307-B6 -> 64.384446906590156 | D6: =$B$4-B6 -> 5.0538346551368249 | E6: 884.1 | F6: 818 | G6: 1661.0 | H6: =F6/G6*$E$27 -> 718.01971607465384 | I6: 118.1 | J6: =($I$25-280)*B6/$B$25 -> 116.93029631398308 | K6: 20 | M6: =J6+K6+L6-I6 -> 18.830296313983098
A7: The Law | B7: =(E7^2/(E7^2+H7^2))*($J$1*6.2307) -> 90.458676044354434 | C7: =$J$1*6.2307-B7 -> 71.539523955645564 | D7: =$B$4-B7 -> 12.208911704192232 | E7: 761.4 | F7: 695 | G7: 1496.5 | H7: =F7/G7*$E$27 -> 677.11242298696959 | I7: 119.25 | J7: =($I$25-280)*B7/$B$25 -> 108.35931883404935 | L7: -11 | M7: =J7+K7+L7-I7 -> -21.890681165950653
A8: A Few Good Men | B8: =(E8^2/(E8^2+H8^2))*($J$1*6.2307) -> 88.887699614271611 | C8: =$J$1*6.2307-B8 -> 73.110500385728386 | D8: =$B$4-B8 -> 13.779888134275055 | E8: 802.4 | F8: 768 | G8: 1538.7 | H8: =F8/G8*$E$27 -> 727.71271748878917 | I8: 109.2 | J8: =($I$25-280)*B8/$B$25 -> 106.47746577901842 | M8: =J8+K8+L8-I8 -> -2.7225342209815864
A9: Maryland Crabs | B9: =(E9^2/(E9^2+H9^2))*($J$1*6.2307) -> 86.277336023022372 | C9: =$J$1*6.2307-B9 -> 75.720863976977625 | D9: =$B$4-B9 -> 16.390251725524294 | E9: 828 | F9: 779 | G9: 1464.2 | H9: =F9/G9*$E$27 -> 775.69278800710288 | I9: 115.45 | J9: =($I$25-280)*B9/$B$25 -> 103.35054381834017 | L9: 8 | M9: =J9+K9+L9-I9 -> -4.0994561816598321
A10: London Sex Pistols | B10: =(E10^2/(E10^2+H10^2))*($J$1*6.2307) -> 85.820265576846182 | C10: =$J$1*6.2307-B10 -> 76.177934423153815 | D10: =$B$4-B10 -> 16.847322171700483 | E10: 805.8 | F10: 654 | G10: 1352.8 | H10: =($J$1*6.2307*9-G10)+F10 -> 759.18380000000002 | I10: 108.9 | J10: =($I$25-280)*B10/$B$25 -> 102.80302483649545 | L10: 3 | M10: =J10+K10+L10-I10 -> -3.0969751635045526
A11: Field of Schemes | B11: =(E11^2/(E11^2+H11^2))*($J$1*6.2307) -> 85.533187760139768 | C11: =$J$1*6.2307-B11 -> 76.465012239860229 | D11: =$B$4-B11 -> 17.134399988406898 | E11: 740.1 | F11: 704 | G11: 1466.8 | H11: =F11/G11*$E$27 -> 699.76860867193886 | I11: 114.35 | J11: =($I$25-280)*B11/$B$25 -> 102.45913790346738 | M11: =J11+K11+L11-I11 -> -11.890862096532615
A12: Jake's Chargers | B12: =(E12^2/(E12^2+H12^2))*($J$1*6.2307) -> 85.006062447312132 | C12: =$J$1*6.2307-B12 -> 76.992137552687865 | D12: =$B$4-B12 -> 17.661525301234533 | E12: 698 | F12: 592 | G12: 1385.7 | H12: =($J$1*6.2307*9-G12)+F12 -> 664.28379999999993 | I12: 117.45 | J12: =($I$25-280)*B12/$B$25 -> 101.82770107135873 | M12: =J12+K12+L12-I12 -> -15.622298928641271
A13: The GriTTs | B13: =(E13^2/(E13^2+H13^2))*($J$1*6.2307) -> 84.423418359687901 | C13: =$J$1*6.2307-B13 -> 77.574781640312096 | D13: =$B$4-B13 -> 18.244169388858765 | E13: 716.8 | F13: 735 | G13: 1559.6 | H13: =F13/G13*$E$27 -> 687.11085727109514 | I13: 116.5 | J13: =($I$25-280)*B13/$B$25 -> 101.12975899196449 | M13: =J13+K13+L13-I13 -> -15.370241008035507
A14: The Bulldogs | B14: =(E14^2/(E14^2+H14^2))*($J$1*6.2307) -> 82.597275115885353 | C14: =$J$1*6.2307-B14 -> 79.400924884114644 | D14: =$B$4-B14 -> 20.070312632661313 | E14: 784.1 | F14: 827 | G14: 1568.4 | H14: =F14/G14*$E$27 -> 768.77875707727617 | I14: 118.35 | J14: =($I$25-280)*B14/$B$25 -> 98.942244796036846 | L14: -8.5 | M14: =J14+K14+L14-I14 -> -27.907755203963148
A15: Springfield Homers | B15: =(E15^1.83/(E15^1.83+H15^1.83))*($J$1*6.2307) -> 81.766725673653482 | C15: =$J$1*6.2307-B15 -> 80.231474326346515 | D15: =$B$4-B15 -> 20.900862074893183 | E15: 749.8 | F15: 814 | G15: 1599.3 | H15: =F15/G15*$E$27 -> 742.07391558806967 | I15: 115.9 | J15: =($I$25-280)*B15/$B$25 -> 97.94733998697113 | L15: -1 | M15: =J15+K15+L15-I15 -> -18.952660013028876
A16: Tallahassee Turkhounds | B16: =(E16^2/(E16^2+H16^2))*($J$1*6.2307) -> 67.459692315690972 | C16: =$J$1*6.2307-B16 -> 94.538507684309025 | D16: =$B$4-B16 -> 35.207895432855693 | E16: 566.8 | F16: 658 | G16: 1445.0 | H16: =($J$1*6.2307*9-G16)+F16 -> 670.98379999999997 | I16: 108.65 | J16: =($I$25-280)*B16/$B$25 -> 80.809123322770986 | M16: =J16+K16+L16-I16 -> -27.840876677229019
A17: Reason | B17: =(E17^2/(E17^2+H17^2))*($J$1*6.2307) -> 65.292599960737007 | C17: =$J$1*6.2307-B17 -> 96.70560003926299 | D17: =$B$4-B17 -> 37.374987787809658 | E17: 702.2 | F17: 611 | G17: 1214.4 | H17: =($J$1*6.2307*9-G17)+F17 -> 854.58379999999988 | I17: 109.7 | J17: =($I$25-280)*B17/$B$25 -> 78.213190442677231 | M17: =J17+K17+L17-I17 -> -31.486809557322772
A18: Culver City Crush | B18: =(E18^2/(E18^2+H18^2))*($J$1*6.2307) -> 63.485869880832794 | C18: =$J$1*6.2307-B18 -> 98.512330119167203 | D18: =$B$4-B18 -> 39.181717867713871 | E18: 587.7 | F18: 757 | G18: 1507.6 | H18: =F18/G18*$E$27 -> 732.08658569912438 | I18: 107.5 | J18: =($I$25-280)*B18/$B$25 -> 76.048931033448056 | M18: =J18+K18+L18-I18 -> -31.451068966551944
A19: Strousberg Slugpuppets | B19: =(E19^2/(E19^2+H19^2))*($J$1*6.2307) -> 62.713430025921198 | C19: =$J$1*6.2307-B19 -> 99.284769974078799 | D19: =$B$4-B19 -> 39.954157722625467 | E19: 650.9 | F19: 719 | G19: 1358.0 | H19: =($J$1*6.2307*9-G19)+F19 -> 818.98379999999997 | I19: 74.45 | J19: =($I$25-280)*B19/$B$25 -> 75.123634973648862 | L19: -1 | M19: =J19+K19+L19-I19 -> -0.32636502635114084
A20: Colorado Hussars | B20: =(E20^2/(E20^2+H20^2))*($J$1*6.2307) -> 61.90668473238722 | C20: =$J$1*6.2307-B20 -> 100.09151526761278 | D20: =$B$4-B20 -> 40.760903016159446 | E20: 652.1 | F20: 831 | G20: 1461.2 | H20: =F20/G20*$E$27 -> 829.17091281138778 | I20: 95.6 | J20: =($I$25-280)*B20/$B$25 -> 74.15724485716018 | L20: 23 | M20: =J20+K20+L20-I20 -> 1.5572448571601853
A21: Burrito Benders | B21: =(E21^2/(E21^2+H21^2))*($J$1*6.2307) -> 54.565221573480173 | C21: =$J$1*6.2307-B21 -> 107.43297842651982 | D21: =$B$4-B21 -> 48.102366175066493 | E21: 568.7 | F21: 663 | G21: 1323.0 | H21: =($J$1*6.2307*9-G21)+F21 -> 797.98379999999997 | I21: 93.95 | J21: =($I$25-280)*B21/$B$25 -> 65.362997782900848 | L21: 9.5 | M21: =J21+K21+L21-I21 -> -19.087002217099155
A22: Brooklyn Ballers | B22: =(E22^2/(E22^2+H22^2))*($J$1*6.2307) -> 36.353546492888242 | C22: =$J$1*6.2307-B22 -> 125.64465350711176 | D22: =$B$4-B22 -> 66.314041255658424 | E22: 455.7 | F22: 675 | G22: 1285.8 | H22: =($J$1*6.2307*9-G22)+F22 -> 847.18380000000002 | I22: 58.6 | J22: =($I$25-280)*B22/$B$25 -> 43.547459540970841 | L22: -10 | M22: =J22+K22+L22-I22 -> -25.05254045902916
A23: Kitty O'Sheas | B23: =(E23^2/(E23^2+H23^2))*($J$1*6.2307) -> 31.432807168063043 | C23: =$J$1*6.2307-B23 -> 130.56539283193695 | D23: =$B$4-B23 -> 71.23478058048363 | E23: 503.7 | F23: 613 | G23: 1044.4 | H23: =($J$1*6.2307*9-G23)+F23 -> 1026.5837999999999 | I23: 58.9 | J23: =($I$25-280)*B23/$B$25 -> 37.652967329560056 | L23: -1 | M23: =J23+L23+K23-I23 -> -22.247032670439943
A25: Totals | B25: =SUM(B4:B23) -> 1514.8333831949715 | C25: =SUM(C4:C23) -> 1725.1306168050287 | I25: =SUM(I4:I23) -> 2094.6 | J25: =SUM(J4:J23) -> 1814.6 | K25: 280 | L25: =SUM(L4:L23) -> 0 | M25: =SUM(M4:M23) -> -3.5527136788005009E-14
A27: Current innings pitched requirement: | E27: =$J$1*9*6.2307 -> 1457.9838
A29: RA is calculated as follows:
A30: IPRequired-IP+Actual RA (teams below IP requirement)
A31: TeamERA/9*IPRequired (teams above IP requirement)
A33: Questions? Email the commissioner