A1: Official League Standings | J1: As of week | K1: 26
G2: Current innings pitched requirement: | K2: =$K$1*9*6.2307 -> 1457.9838
A4: Moonlight Graham Division
A5: Team | B5: W | C5: L | D5: GB | E5: RS | F5: RA | G5: ARA | H5: IP | I5: Payroll | J5: Tax | K5: Revenue | L5: Fees | M5: Prize | N5: Profit/Loss | O5: Deposit | P5: Balance
A6: Raindogs | B6: =(E6^2/(E6^2+F6^2))*($K$1*6.2307) -> 91.707977173798412 | C6: =$K$1*6.2307-B6 -> 70.290222826201585 | D6: =$B$6-B6 -> 0.0 | E6: 844.9 | F6: =G6/H6*$K$2 -> 739.68908982035919 | G6: 771 | H6: 1519.7 | I6: 114.13076923076923 | J6: 0 | K6: =($I$36+$J$36+$L$36-$M$36)*B6/$B$36 -> 130.75985205377751 | L6: 22.3 | M6: 15 | N6: =K6+M6-I6-J6-L6 -> 9.3290828230082745 | O6: 40 | P6: =N6+O6 -> 49.329082823008278
A7: Broad Ripple Baseball Club | B7: =(E7^2/(E7^2+F7^2))*($K$1*6.2307) -> 88.854489753834031 | C7: =$K$1*6.2307-B7 -> 73.143710246165966 | D7: =$B$6-B7 -> 2.8534874199643809 | E7: 784.2 | F7: =G7/H7*$K$2 -> 711.50120917120842 | G7: 779 | H7: 1596.3 | I7: 126.13653846153839 | J7: 62.519230769230738 | K7: =($I$36+$J$36+$L$36-$M$36)*B7/$B$36 -> 126.6912682252983 | N7: =K7+M7-I7-J7-L7 -> -61.964501005470829 | O7: 116 | P7: =N7+O7 -> 54.035498994529171
A8: Grim Reapers | B8: =(E8^2/(E8^2+F8^2))*($K$1*6.2307) -> 84.983695722881976 | C8: =$K$1*6.2307-B8 -> 77.014504277118021 | D8: =$B$6-B8 -> 6.7242814509164361 | E8: 755.1 | F8: =G8/H8*$K$2 -> 718.82459059863402 | G8: 859 | H8: 1742.3 | I8: 114.81923076923073 | J8: 0 | K8: =($I$36+$J$36+$L$36-$M$36)*B8/$B$36 -> 121.17217958747209 | L8: 5.6 | N8: =K8+M8-I8-J8-L8 -> 0.75294881824135906 | O8: 58.89 | P8: =N8+O8 -> 59.642948818241358
A9: Oshawa Outlaws | B9: =(E9^2/(E9^2+F9^2))*($K$1*6.2307) -> 67.053149699792897 | C9: =$K$1*6.2307-B9 -> 94.9450503002071 | D9: =$B$6-B9 -> 24.654827474005515 | E9: 719.6 | F9: =G9-H9+$K$2 -> 856.28379999999993 | G9: 712 | H9: 1313.7 | I9: 108.69230769230764 | J9: 0 | K9: =($I$36+$J$36+$L$36-$M$36)*B9/$B$36 -> 95.60629516305319 | L9: 6.9 | N9: =K9+M9-I9-J9-L9 -> -19.986012529254445 | O9: -46.65 | P9: =N9+O9 -> -66.636012529254444
A10: Future Kingpins | B10: =(E10^2/(E10^2+F10^2))*($K$1*6.2307) -> 66.750362266041947 | C10: =$K$1*6.2307-B10 -> 95.24783773395805 | D10: =$B$6-B10 -> 24.957614907756465 | E10: 585.4 | F10: =G10-H10+$K$2 -> 699.28379999999993 | G10: 559 | H10: 1317.7 | I10: 114.08269230769233 | J10: 0 | K10: =($I$36+$J$36+$L$36-$M$36)*B10/$B$36 -> 95.174572195639087 | L10: 5.25 | M10: -15 | N10: =K10+M10-I10-J10-L10 -> -39.15812011205324 | O10: 36 | P10: =N10+O10 -> -3.1581201120532398
A12: Rick Vaughn Division
A13: Team | B13: W | C13: L | D13: GB | E13: RS | F13: RA | G13: ARA | H13: IP | I13: Payroll | J13: Tax | K13: Revenue | L13: Fees | M13: Prize | N13: Profit/Loss | O13: Deposit | P13: Balance
A14: Burrito Benders | B14: =(E14^2/(E14^2+F14^2))*($K$1*6.2307) -> 101.97902440229488 | C14: =$K$1*6.2307-B14 -> 60.019175597705114 | D14: =$B$14-B14 -> 0.0 | E14: 969.5 | F14: =G14/H14*$K$2 -> 743.76784689766316 | G14: 823 | H14: 1613.3 | I14: 85.623076923076923 | J14: 0 | K14: =($I$36+$J$36+$L$36-$M$36)*B14/$B$36 -> 145.40460442346858 | M14: 15 | N14: =K14+M14-I14-J14-L14 -> 74.781527500391661 | O14: 30 | P14: =N14+O14 -> 104.78152750039166
A15: Monroe County Cougars | B15: =(E15^2/(E15^2+F15^2))*($K$1*6.2307) -> 100.50696484589311 | C15: =$K$1*6.2307-B15 -> 61.491235154106889 | D15: =$B$14-B15 -> 1.4720595564017742 | E15: 906.8 | F15: =G15-H15+$K$2 -> 709.28379999999993 | G15: 698 | H15: 1446.7 | I15: 119.70384615384614 | J15: 2.1153846153846154 | K15: =($I$36+$J$36+$L$36-$M$36)*B15/$B$36 -> 143.30569988166783 | N15: =K15+M15-I15-J15-L15 -> 21.486469112437074 | O15: 26 | P15: =N15+O15 -> 47.486469112437078
A16: LB Cats | B16: =(E16^2/(E16^2+F16^2))*($K$1*6.2307) -> 95.808810007356527 | C16: =$K$1*6.2307-B16 -> 66.18938999264347 | D16: =$B$14-B16 -> 6.1702143949383554 | E16: 858.6 | F16: =G16/H16*$K$2 -> 713.64520224206478 | G16: 751 | H16: 1534.3 | I16: 121.88653846153844 | J16: 30.115384615384599 | K16: =($I$36+$J$36+$L$36-$M$36)*B16/$B$36 -> 136.60693658380828 | L16: 3.5 | N16: =K16+M16-I16-J16-L16 -> -18.894986493114757 | O16: -11.34 | P16: =N16+O16 -> -30.234986493114757
A17: BuddhaBall | B17: =(E17^2/(E17^2+F17^2))*($K$1*6.2307) -> 88.948266235294781 | C17: =$K$1*6.2307-B17 -> 73.049933764705216 | D17: =$B$14-B17 -> 13.030758167000101 | E17: 850.1 | F17: =G17/H17*$K$2 -> 770.39097377452561 | G17: 816 | H17: 1544.3 | I17: 112.81153846153842 | J17: 0 | K17: =($I$36+$J$36+$L$36-$M$36)*B17/$B$36 -> 126.82497740981877 | N17: =K17+M17-I17-J17-L17 -> 14.013438948280353 | O17: 41 | P17: =N17+O17 -> 55.013438948280353
A18: Paul's Pounders | B18: =(E18^2/(E18^2+F18^2))*($K$1*6.2307) -> 55.68522268842603 | C18: =$K$1*6.2307-B18 -> 106.31297731157397 | D18: =$B$14-B18 -> 46.293801713868852 | E18: 616.1 | F18: =G18-H18+$K$2 -> 851.28379999999993 | G18: 830 | H18: 1436.7 | I18: 49.603846153846135 | J18: 0 | K18: =($I$36+$J$36+$L$36-$M$36)*B18/$B$36 -> 79.397580283785658 | M18: -15 | N18: =K18+M18-I18-J18-L18 -> 14.793734129939523 | O18: 31.17 | P18: =N18+O18 -> 45.963734129939525
A20: Crash Davis Division
A21: Team | B21: W | C21: L | D21: GB | E21: RS | F21: RA | G21: ARA | H21: IP | I21: Payroll | J21: Tax | K21: Revenue | L21: Fees | M21: Prize | N21: Profit/Loss | O21: Deposit | P21: Balance
A22: Philadelphia Bulldogs | B22: =(E22^2/(E22^2+F22^2))*($K$1*6.2307) -> 92.378880074259271 | C22: =$K$1*6.2307-B22 -> 69.619319925740726 | D22: =$B$22-B22 -> 0.0 | E22: 825.1 | F22: =G22-H22+$K$2 -> 716.28379999999993 | G22: 693 | H22: 1434.7 | I22: 139.44615384615389 | J22: 194.46153846153848 | K22: =($I$36+$J$36+$L$36-$M$36)*B22/$B$36 -> 131.71644456306879 | L22: 2.4 | M22: 15 | N22: =K22+M22-I22-J22-L22 -> -189.59124774462359 | O22: 102.51 | P22: =N22+O22 -> -87.081247744623582
A23: Atonic Spiloman | B23: =(E23^2/(E23^2+F23^2))*($K$1*6.2307) -> 87.413327476389171 | C23: =$K$1*6.2307-B23 -> 74.584872523610827 | D23: =$B$22-B23 -> 4.9655525978701007 | E23: 858.8 | F23: =G23-H23+$K$2 -> 793.28379999999993 | G23: 693 | H23: 1357.7 | I23: 122.31538461538456 | J23: 24.615384615384599 | K23: =($I$36+$J$36+$L$36-$M$36)*B23/$B$36 -> 124.63641790593026 | N23: =K23+M23-I23-J23-L23 -> -22.2943513248389 | O23: 38.53 | P23: =N23+O23 -> 16.235648675161102
A24: L Millz | B24: =(E24^2/(E24^2+F24^2))*($K$1*6.2307) -> 85.055152109188171 | C24: =$K$1*6.2307-B24 -> 76.943047890811826 | D24: =$B$22-B24 -> 7.3237279650711002 | E24: 880 | F24: =G24-H24+$K$2 -> 836.98379999999997 | G24: 770 | H24: 1391.0 | I24: 116.52692307692308 | J24: 0 | K24: =($I$36+$J$36+$L$36-$M$36)*B24/$B$36 -> 121.2740641430979 | L24: 1 | N24: =K24+M24-I24-J24-L24 -> 3.7471410661748195 | O24: 26 | P24: =N24+O24 -> 29.747141066174819
A25: The Unsullied | B25: =(E25^2/(E25^2+F25^2))*($K$1*6.2307) -> 81.501345799765929 | C25: =$K$1*6.2307-B25 -> 80.496854200234068 | D25: =$B$22-B25 -> 10.877534274493343 | E25: 812.4 | F25: =G25/H25*$K$2 -> 807.37812580645152 | G25: 824 | H25: 1488.0 | I25: 57.355769230769234 | J25: 0 | K25: =($I$36+$J$36+$L$36-$M$36)*B25/$B$36 -> 116.2069456484093 | N25: =K25+M25-I25-J25-L25 -> 58.851176417640069 | O25: 78.8 | P25: =N25+O25 -> 137.65117641764007
A26: Little Jerry Seinfeld | B26: =(E26^2/(E26^2+F26^2))*($K$1*6.2307) -> 74.382227490372273 | C26: =$K$1*6.2307-B26 -> 87.615972509627724 | D26: =$B$22-B26 -> 17.996652583886998 | E26: 639.7 | F26: =G26/H26*$K$2 -> 694.27799999999991 | G26: 697 | H26: 1463.7 | I26: 117.02884615384622 | J26: 0 | K26: =($I$36+$J$36+$L$36-$M$36)*B26/$B$36 -> 106.05630351696759 | L26: 10.65 | M26: -15 | N26: =K26+M26-I26-J26-L26 -> -36.622542636878627 | O26: 17.36 | P26: =N26+O26 -> -19.262542636878628
A28: Pedro Cerrano Division
A29: Team | B29: W | C29: L | D29: GB | E29: RS | F29: RA | G29: ARA | H29: IP | I29: Payroll | J29: Tax | K29: Revenue | L29: Fees | M29: Prize | N29: Profit/Loss | O29: Deposit | P29: Balance
A30: Arsenal | B30: =(E30^2/(E30^2+F30^2))*($K$1*6.2307) -> 109.26276064775345 | C30: =$K$1*6.2307-B30 -> 52.735439352246544 | D30: =$B$30-B30 -> 0.0 | E30: 864 | F30: =G30/H30*$K$2 -> 600.24554045867592 | G30: 666 | H30: 1617.7 | I30: 118.40192307692307 | J30: 0 | K30: =($I$36+$J$36+$L$36-$M$36)*B30/$B$36 -> 155.78996350787997 | L30: 5.75 | M30: 200 | N30: =K30+M30-I30-J30-L30 -> 231.63804043095689 | O30: 0 | P30: =N30+O30 -> 231.63804043095689
A31: Steely Blues | B31: =(E31^2/(E31^2+F31^2))*($K$1*6.2307) -> 86.868807218874537 | C31: =$K$1*6.2307-B31 -> 75.12939278112546 | D31: =$B$30-B31 -> 22.393953428878916 | E31: 708.2 | F31: =G31/H31*$K$2 -> 658.61092825509297 | G31: 663 | H31: 1467.7 | I31: 120.11538461538463 | J31: 1.1538461538461702 | K31: =($I$36+$J$36+$L$36-$M$36)*B31/$B$36 -> 123.86002537708883 | L31: 7.2 | N31: =K31+M31-I31-J31-L31 -> -4.6092053921419662 | O31: 32.19 | P31: =N31+O31 -> 27.580794607858031
A32: Alexandria Fire | B32: =(E32^2/(E32^2+F32^2))*($K$1*6.2307) -> 67.631347844732105 | C32: =$K$1*6.2307-B32 -> 94.366852155267892 | D32: =$B$30-B32 -> 41.631412803021348 | E32: 711.7 | F32: =G32-H32+$K$2 -> 840.68380000000002 | G32: 731 | H32: 1348.3 | I32: 104.3846153846154 | J32: 0 | K32: =($I$36+$J$36+$L$36-$M$36)*B32/$B$36 -> 96.430706585265 | N32: =K32+M32-I32-J32-L32 -> -7.9539087993504012 | O32: 39.04 | P32: =N32+O32 -> 31.086091200649598
A33: The Mayhem 5 | B33: =(E33^2/(E33^2+F33^2))*($K$1*6.2307) -> 59.374747388200639 | C33: =$K$1*6.2307-B33 -> 102.62345261179937 | D33: =$B$30-B33 -> 49.888013259552814 | E33: 692.7 | F33: =G33-H33+$K$2 -> 910.68380000000002 | G33: 682 | H33: 1229.3 | I33: 61.74807692307688 | J33: 0 | K33: =($I$36+$J$36+$L$36-$M$36)*B33/$B$36 -> 84.658209934104917 | N33: =K33+M33-I33-J33-L33 -> 22.910133011028037 | O33: 44.86 | P33: =N33+O33 -> 67.770133011028037
A34: Bears | B34: =(E34^2/(E34^2+F34^2))*($K$1*6.2307) -> 45.12762823685204 | C34: =$K$1*6.2307-B34 -> 116.87057176314795 | D34: =$B$30-B34 -> 64.135132410901406 | E34: 494 | F34: =G34-H34+$K$2 -> 794.98379999999997 | G34: 589 | H34: 1252.0 | I34: 91.373076923076951 | J34: 0 | K34: =($I$36+$J$36+$L$36-$M$36)*B34/$B$36 -> 64.344260702705441 | L34: 9.2 | M34: -15 | N34: =K34+M34-I34-J34-L34 -> -51.228816220371513 | O34: -4 | P34: =N34+O34 -> -55.228816220371513
A36: Totals | B36: =SUM(B6:B34) -> 1631.2741870820023 | C36: =SUM(C6:C34) -> 1608.6898129179976 | I36: =SUM(I6:I34) -> 2116.1865384615385 | J36: =SUM(J6:J34) -> 314.98076923076923 | K36: =SUM(K6:K34) -> 2325.9173076923071 | L36: =SUM(L6:L34) -> 79.75 | M36: =SUM(M6:M34) -> 185 | N36: =SUM(N6:N34) -> -1.7763568394002505E-13
A39: Definitions:
A40: ARA: Actual Runs Allowed by your fantasy staff
A41: RA: IPRequired-IP+Actual RA (teams below IP requirement)
A42: TeamERA/9*IPRequired (teams above IP requirement)
A44: Notes:
A45: The $200 prize goes to the team with the best record in the league.
A46: The "Fees" column is for preseason or in-season drops of players with multi-year contracts.
A47: The "Profit/Loss" Column shows your balance for this season only.
A48: The "Deposit" column shows your balance carried over from last season minus this season's admin fee plus any deposits paid
A49: The "Balance" column shows the amount to be paid or payable to/from each owner at season's end.
A51: Jeff Sosnowski is a douchebag who owes me $51.68