A1: Official League Standings | J1: As of week | K1: 26
A2: Current innings pitched requirement: | B2: =$K$1*9*6.2307 -> 1457.9838
A4: Moonlight Graham Division
A5: Team | B5: W | C5: L | D5: GB | E5: RS | F5: RA | G5: ARA | H5: IP | I5: Payroll | J5: Cap | K5: Revenue | L5: Fees | M5: Prize | N5: Balance
A6: Fear Itself | B6: =(E6^2/(E6^2+F6^2))*($K$1*6.2307) -> 102.14437636298472 | C6: =$K$1*6.2307-B6 -> 59.853823637015282 | D6: =$B$6-B6 -> 0.0 | E6: 806 | F6: =G6-H6+$B$2 -> 616.98379999999997 | G6: 557 | H6: 1398.0 | I6: 131.1 | J6: 131.75 | K6: =($I$36+$L$36-$M$36)*B6/$B$36 -> 125.22396506397509 | L6: 0.3 | M6: 15 | N6: =K6+M6-I6-L6 -> 8.8239650639750771
A7: Oshawa Mallards | B7: =(E7^2/(E7^2+F7^2))*($K$1*6.2307) -> 86.647034900599948 | C7: =$K$1*6.2307-B7 -> 75.351165099400049 | D7: =$B$6-B7 -> 15.497341462384767 | E7: 831.5 | F7: =G7/H7*$B$2 -> 775.40819522089748 | G7: 1075 | H7: 2021.3 | I7: 176.75 | J7: 177 | K7: =($I$36+$L$36-$M$36)*B7/$B$36 -> 106.22498915389831 | L7: 1.85 | N7: =K7+M7-I7-L7 -> -72.375010846101688
A8: T-Town Raindogs | B8: =(E8^2/(E8^2+F8^2))*($K$1*6.2307) -> 82.532288753455973 | C8: =$K$1*6.2307-B8 -> 79.465911246544024 | D8: =$B$6-B8 -> 19.612087609528743 | E8: 833.4 | F8: =G8/H8*$B$2 -> 817.77152750722109 | G8: 835 | H8: 1488.7 | I8: 114.9 | J8: 120 | K8: =($I$36+$L$36-$M$36)*B8/$B$36 -> 101.18051342137225 | L8: 0.95 | N8: =K8+M8-I8-L8 -> -14.669486578627751
A9: C-Ville Parrots | B9: =(E9^2/(E9^2+F9^2))*($K$1*6.2307) -> 61.221766162823776 | C9: =$K$1*6.2307-B9 -> 100.77643383717623 | D9: =$B$6-B9 -> 40.922610200160939 | E9: 748 | F9: =G9-H9+$B$2 -> 959.68380000000002 | G9: 665 | H9: 1163.3 | I9: 78.4 | J9: 104 | K9: =($I$36+$L$36-$M$36)*B9/$B$36 -> 75.054864301922294 | N9: =K9+M9-I9-L9 -> -3.345135698077712
A10: North Bethesda Lindy Hoppers | B10: =(E10^2/(E10^2+F10^2))*($K$1*6.2307) -> 57.836331736477781 | C10: =$K$1*6.2307-B10 -> 104.16186826352222 | D10: =$B$6-B10 -> 44.308044626506934 | E10: 736.2 | F10: =G10-H10+$B$2 -> 987.98379999999997 | G10: 611 | H10: 1081.0 | I10: 69.3 | J10: 76.15 | K10: =($I$36+$L$36-$M$36)*B10/$B$36 -> 70.904488750902161 | L10: 0.3 | M10: -15 | N10: =K10+M10-I10-L10 -> -13.695511249097837
A12: Rick Vaughn Division
A13: Team | B13: W | C13: L | D13: GB | E13: RS | F13: RA | G13: ARA | H13: IP | I13: Payroll | J13: Cap | K13: Revenue | L13: Fees | M13: Prize | N13: Balance
A14: LB Cats | B14: =(E14^2/(E14^2+F14^2))*($K$1*6.2307) -> 106.69903869065128 | C14: =$K$1*6.2307-B14 -> 55.299161309348719 | D14: =$B$14-B14 -> 0.0 | E14: 909.1 | F14: =G14/H14*$B$2 -> 654.47140583554381 | G14: 660 | H14: 1470.3 | I14: 138.95 | J14: 146.1 | K14: =($I$36+$L$36-$M$36)*B14/$B$36 -> 130.8077563259736 | M14: 200 | N14: =K14+M14-I14-L14 -> 191.85775632597364
A15: Burrito Benders | B15: =(E15^2/(E15^2+F15^2))*($K$1*6.2307) -> 99.528257180423239 | C15: =$K$1*6.2307-B15 -> 62.469942819576758 | D15: =$B$14-B15 -> 7.1707815102280392 | E15: 965.2 | F15: =G15/H15*$B$2 -> 764.67988787860543 | G15: 871 | H15: 1660.7 | I15: 119.4 | J15: 119.4 | K15: =($I$36+$L$36-$M$36)*B15/$B$36 -> 122.01673203965179 | N15: =K15+M15-I15-L15 -> 2.6167320396517795
A16: BuddhaBall | B16: =(E16^2/(E16^2+F16^2))*($K$1*6.2307) -> 75.523968310255555 | C16: =$K$1*6.2307-B16 -> 86.474231689744443 | D16: =$B$14-B16 -> 31.175070380395724 | E16: 760.6 | F16: =G16/H16*$B$2 -> 813.87419058251783 | G16: 850 | H16: 1522.7 | I16: 103.3 | J16: 106 | K16: =($I$36+$L$36-$M$36)*B16/$B$36 -> 92.588658386516897 | L16: 6 | N16: =K16+M16-I16-L16 -> -16.7113416134831
A17: Paul's Pounders | B17: =(E17^2/(E17^2+F17^2))*($K$1*6.2307) -> 53.122151172406163 | C17: =$K$1*6.2307-B17 -> 108.87604882759383 | D17: =$B$14-B17 -> 53.576887518245115 | E17: 576.2 | F17: =G17/H17*$B$2 -> 824.90056884955754 | G17: 959 | H17: 1695.0 | I17: 84.7 | J17: 92 | K17: =($I$36+$L$36-$M$36)*B17/$B$36 -> 65.12513600256527 | N17: =K17+M17-I17-L17 -> -19.574863997434733
A18: Naughty Figs | B18: =(E18^2/(E18^2+F18^2))*($K$1*6.2307) -> 53.457013675215265 | C18: =$K$1*6.2307-B18 -> 108.54118632478473 | D18: =$B$14-B18 -> 53.242025015436013 | E18: 668.3 | F18: =G18-H18+$B$2 -> 952.28379999999993 | G18: 494 | H18: 999.7 | I18: 81.2 | J18: 120 | K18: =($I$36+$L$36-$M$36)*B18/$B$36 -> 65.535660907078736 | M18: -15 | N18: =K18+M18-I18-L18 -> -30.664339092921267
A20: Crash Davis Division
A21: Team | B21: W | C21: L | D21: GB | E21: RS | F21: RA | G21: ARA | H21: IP | I21: Payroll | J21: Cap | K21: Revenue | L21: Fees | M21: Prize | N21: Balance
A22: Philadelphia Bulldogs | B22: =(E22^2/(E22^2+F22^2))*($K$1*6.2307) -> 102.01383936584008 | C22: =$K$1*6.2307-B22 -> 59.984360634159913 | D22: =$B$22-B22 -> 0.0 | E22: 923.8 | F22: =G22/H22*$B$2 -> 708.38185534062234 | G22: 751 | H22: 1545.7 | I22: 134.95 | J22: 136 | K22: =($I$36+$L$36-$M$36)*B22/$B$36 -> 125.06393314687858 | L22: 2 | M22: 15 | N22: =K22+M22-I22-L22 -> 3.113933146878594
A23: The Natural | B23: =(E23^2/(E23^2+F23^2))*($K$1*6.2307) -> 98.605533280365236 | C23: =$K$1*6.2307-B23 -> 63.392666719634761 | D23: =$B$22-B23 -> 3.4083060854748481 | E23: 867 | F23: =G23/H23*$B$2 -> 695.16510706119709 | G23: 709 | H23: 1487.0 | I23: 119.25 | J23: 124 | K23: =($I$36+$L$36-$M$36)*B23/$B$36 -> 120.88551807037808 | N23: =K23+M23-I23-L23 -> 1.6355180703780832
A24: Atonic Spiloman | B24: =(E24^2/(E24^2+F24^2))*($K$1*6.2307) -> 81.004443103517289 | C24: =$K$1*6.2307-B24 -> 80.993756896482708 | D24: =$B$22-B24 -> 21.009396262322795 | E24: 869 | F24: =G24/H24*$B$2 -> 868.9426783282313 | G24: 954 | H24: 1600.7 | I24: 87.4 | J24: 109 | K24: =($I$36+$L$36-$M$36)*B24/$B$36 -> 99.307450046731105 | L24: 3.05 | N24: =K24+M24-I24-L24 -> 8.857450046731099
A25: Hotel Illness | B25: =(E25^2/(E25^2+F25^2))*($K$1*6.2307) -> 70.361050645420988 | C25: =$K$1*6.2307-B25 -> 91.637149354579009 | D25: =$B$22-B25 -> 31.652788720419096 | E25: 778.1 | F25: =G25-H25+$B$2 -> 887.98379999999997 | G25: 708 | H25: 1278.0 | I25: 96.1 | J25: 120 | K25: =($I$36+$L$36-$M$36)*B25/$B$36 -> 86.259176095764843 | L25: 0.3 | N25: =K25+M25-I25-L25 -> -10.140823904235152
A26: The Unsullied | B26: =(E26^2/(E26^2+F26^2))*($K$1*6.2307) -> 63.249936947044873 | C26: =$K$1*6.2307-B26 -> 98.748263052955124 | D26: =$B$22-B26 -> 38.763902418795212 | E26: 668.5 | F26: =G26/H26*$B$2 -> 835.2877183098592 | G26: 842 | H26: 1469.7 | I26: 35.45 | J26: 120 | K26: =($I$36+$L$36-$M$36)*B26/$B$36 -> 77.541301602440313 | M26: -15 | N26: =K26+M26-I26-L26 -> 27.091301602440311
A28: Pedro Cerrano Division
A29: Team | B29: W | C29: L | D29: GB | E29: RS | F29: RA | G29: ARA | H29: IP | I29: Payroll | J29: Cap | K29: Revenue | L29: Fees | M29: Prize | N29: Balance
A30: Bloomington Angels | B30: =(E30^2/(E30^2+F30^2))*($K$1*6.2307) -> 99.748164657790525 | C30: =$K$1*6.2307-B30 -> 62.250035342209472 | D30: =$B$30-B30 -> 0.0 | E30: 934.1 | F30: =G30/H30*$B$2 -> 737.92243860355438 | G30: 880 | H30: 1738.7 | I30: 129.1 | J30: 131 | K30: =($I$36+$L$36-$M$36)*B30/$B$36 -> 122.28632775547746 | L30: 13.3 | M30: 15 | N30: =K30+M30-I30-L30 -> -5.1136722445225367
A31: Arsenal | B31: =(E31^2/(E31^2+F31^2))*($K$1*6.2307) -> 85.864337026424323 | C31: =$K$1*6.2307-B31 -> 76.133862973575674 | D31: =$B$30-B31 -> 13.883827631366202 | E31: 875.8 | F31: =G31-H31+$B$2 -> 824.68380000000002 | G31: 812 | H31: 1445.3 | I31: 112.75 | J31: 117.6 | K31: =($I$36+$L$36-$M$36)*B31/$B$36 -> 105.2654401827135 | L31: 1.05 | N31: =K31+M31-I31-L31 -> -8.534559817286496
A32: Alexandria Fire | B32: =(E32^2/(E32^2+F32^2))*($K$1*6.2307) -> 78.438475889261767 | C32: =$K$1*6.2307-B32 -> 83.55972411073823 | D32: =$B$30-B32 -> 21.309688768528758 | E32: 749.6 | F32: =G32-H32+$B$2 -> 773.68380000000002 | G32: 772 | H32: 1456.3 | I32: 117.15 | J32: 120 | K32: =($I$36+$L$36-$M$36)*B32/$B$36 -> 96.161700860781025 | N32: =K32+M32-I32-L32 -> -20.988299139218981
A33: The Mayhem 5 | B33: =(E33^2/(E33^2+F33^2))*($K$1*6.2307) -> 64.218128789443682 | C33: =$K$1*6.2307-B33 -> 97.780071210556315 | D33: =$B$30-B33 -> 35.530035868346843 | E33: 767.2 | F33: =G33-H33+$B$2 -> 946.68380000000002 | G33: 690 | H33: 1201.3 | I33: 74.8 | J33: 110 | K33: =($I$36+$L$36-$M$36)*B33/$B$36 -> 78.728257025389183 | L33: 0.55 | N33: =K33+M33-I33-L33 -> 3.3782570253891864
A34: Bears | B34: =(E34^2/(E34^2+F34^2))*($K$1*6.2307) -> 61.575178884655308 | C34: =$K$1*6.2307-B34 -> 100.42302111534468 | D34: =$B$30-B34 -> 38.172985773135217 | E34: 687.5 | F34: =G34-H34+$B$2 -> 877.98379999999997 | G34: 646 | H34: 1226.0 | I34: 90 | J34: 120 | K34: =($I$36+$L$36-$M$36)*B34/$B$36 -> 75.488130859588935 | L34: 2.05 | M34: -15 | N34: =K34+M34-I34-L34 -> -31.561869140411066
A36: Totals | B36: =SUM(B6:B34) -> 1583.7913155350579 | C36: =SUM(C6:C34) -> 1656.172684464942 | I36: =SUM(I6:I34) -> 2094.95 | J36: =SUM(J6:J34)-(120*20) -> 0 | K36: =SUM(K6:K34) -> 1941.65 | L36: =SUM(L6:L34) -> 31.7 | M36: =SUM(M6:M34) -> 185 | N36: =SUM(N6:N34) -> -5.3290705182007514E-13
A39: Definitions:
A40: ARA: Actual Runs Allowed by your fantasy staff
A41: RA: IPRequired-IP+Actual RA (teams below IP requirement)
A42: TeamERA/9*IPRequired (teams above IP requirement)
A44: Notes:
A45: The $200 prize goes to the team with the best record in the league.
A46: The "Fees" column is for preseason drops, or in-season drops of players with multi-year contracts.