A1: Official League Standings | J1: As of week | K1: 26
A2: Current innings pitched requirement: | B2: =$K$1*9*6.2307 -> 1457.9838
A4: Division 1
A5: Team | B5: W | C5: L | D5: GB | E5: RS | F5: RA | G5: ARA | H5: IP | I5: Payroll | J5: Cap | K5: Revenue | L5: Fees | M5: Prize | N5: Balance
A6: North Bethesda Lindy Hoppers | B6: =(E6^2/(E6^2+F6^2))*($K$1*6.2307) -> 104.89480873216327 | C6: =$K$1*6.2307-B6 -> 57.103391267836727 | D6: =$B$6-B6 -> 0.0 | E6: 932.4 | F6: =G6/H6*$B$2 -> 687.9489587211915 | G6: 735 | H6: 1557.7 | I6: 122.3 | J6: 122.05 | K6: =($I$26+$L$26-200)*B6/$B$26 -> 110.64886002117004 | M6: 30 | N6: =K6+M6-I6-L6 -> 18.34886002117004
A7: Bloomington Angels | B7: =(E7^2/(E7^2+F7^2))*($K$1*6.2307) -> 100.1815781170321 | C7: =$K$1*6.2307-B7 -> 61.816621882967894 | D7: =$B$6-B7 -> 4.7132306151311667 | E7: 920 | F7: =G7/H7*$B$2 -> 722.6808175182482 | G7: 876 | H7: 1767.3 | I7: 142.15 | J7: 135.3 | K7: =($I$26+$L$26-200)*B7/$B$26 -> 105.6770830487484 | L7: 2.1 | M7: 20 | N7: =K7+M7-I7-L7 -> -18.572916951251607
A8: Arsenal | B8: =(E8^2/(E8^2+F8^2))*($K$1*6.2307) -> 98.787644290124561 | C8: =$K$1*6.2307-B8 -> 63.210555709875436 | D8: =$B$6-B8 -> 6.1071644420387088 | E8: 889.7 | F8: =$B$2-H8+G8 -> 711.68380000000002 | G8: 702 | H8: 1448.3 | I8: 114.55 | J8: 115 | K8: =($I$26+$L$26-200)*B8/$B$26 -> 104.20668436308901 | L8: 3.85 | N8: =K8+M8-I8-L8 -> -14.193315636910986
A9: Philadelphia Bulldogs | B9: =(E9^2/(E9^2+F9^2))*($K$1*6.2307) -> 98.018612682912121 | C9: =$K$1*6.2307-B9 -> 63.979587317087876 | D9: =$B$6-B9 -> 6.8761960492511491 | E9: 854.4 | F9: =$B$2-H9+G9 -> 690.28379999999993 | G9: 684 | H9: 1451.7 | I9: 123.9 | J9: 124 | K9: =($I$26+$L$26-200)*B9/$B$26 -> 103.39546718573966 | L9: 4.2 | N9: =K9+M9-I9-L9 -> -24.704532814260343
A10: Diamond Dohyo Demigods | B10: =(E10^2/(E10^2+F10^2))*($K$1*6.2307) -> 89.6007357549056 | C10: =$K$1*6.2307-B10 -> 72.397464245094397 | D10: =$B$6-B10 -> 15.29407297725767 | E10: 788.4 | F10: =$B$2-H10+G10 -> 708.68380000000002 | G10: 649 | H10: 1398.3 | I10: 115.75 | J10: 116 | K10: =($I$26+$L$26-200)*B10/$B$26 -> 94.515823882697603 | N10: =K10+M10-I10-L10 -> -21.234176117302397
A11: Atonic Spiloman | B11: =(E11^2/(E11^2+F11^2))*($K$1*6.2307) -> 85.476188852600302 | C11: =$K$1*6.2307-B11 -> 76.522011147399695 | D11: =$B$6-B11 -> 19.418619879562968 | E11: 760.6 | F11: =G11/H11*$B$2 -> 719.65928650646947 | G11: 721 | H11: 1460.7 | I11: 65.15 | J11: 104.7 | K11: =($I$26+$L$26-200)*B11/$B$26 -> 90.165023129447434 | N11: =K11+M11-I11-L11 -> 25.015023129447428
A12: The Natural | B12: =(E12^2/(E12^2+F12^2))*($K$1*6.2307) -> 84.43192665083177 | C12: =$K$1*6.2307-B12 -> 77.566273349168227 | D12: =$B$6-B12 -> 20.4628820813315 | E12: 684.4 | F12: =$B$2-H12+G12 -> 655.98379999999997 | G12: 625 | H12: 1427.0 | I12: 108.1 | J12: 120.5 | K12: =($I$26+$L$26-200)*B12/$B$26 -> 89.063477461120613 | L12: 0.3 | M12: -10 | N12: =K12+M12-I12-L12 -> -29.336522538879382
A13: The Mayhem 5 | B13: =(E13^2/(E13^2+F13^2))*($K$1*6.2307) -> 65.785049929820232 | C13: =$K$1*6.2307-B13 -> 96.213150070179765 | D13: =$B$6-B13 -> 39.109758802343038 | E13: 646.6 | F13: =G13/H13*$B$2 -> 781.96859751854527 | G13: 817 | H13: 1523.3 | I13: 37.1 | J13: 116.65 | K13: =($I$26+$L$26-200)*B13/$B$26 -> 69.393718041438518 | M13: -20 | N13: =K13+M13-I13-L13 -> 12.293718041438517
A15: Division 2
A16: Team | B16: W | C16: L | D16: GB | E16: RS | F16: RA | G16: ARA | H16: IP | I16: Payroll | J16: Cap | K16: Revenue | L16: Fees | M16: Prize | N16: Balance
A17: Burrito Benders | B17: =(E17^2/(E17^2+F17^2))*($K$1*6.2307) -> 107.53533412625862 | C17: =$K$1*6.2307-B17 -> 54.462865873741379 | D17: =$B$17-B17 -> 0.0 | E17: 891.1 | F17: =G17/H17*$B$2 -> 634.1632844483529 | G17: 643 | H17: 1478.3 | I17: 102.45 | J17: 128.15 | K17: =($I$26+$L$26-200)*B17/$B$26 -> 113.43423260771648 | M17: 200 | N17: =K17+M17-I17-L17 -> 210.98423260771648
A18: San Bernadino Inland Empire 66ers | B18: =(E18^2/(E18^2+F18^2))*($K$1*6.2307) -> 101.8430839069953 | C18: =$K$1*6.2307-B18 -> 60.155116093004693 | D18: =$B$17-B18 -> 5.6922502192633146 | E18: 900.9 | F18: =G18/H18*$B$2 -> 692.38412324860508 | G18: 766 | H18: 1613.0 | I18: 144.8 | J18: 130 | K18: =($I$26+$L$26-200)*B18/$B$26 -> 107.42973147625472 | L18: 2.5 | M18: 10 | N18: =K18+M18-I18-L18 -> -29.870268523745295
A19: Alexandria Fire | B19: =(E19^2/(E19^2+F19^2))*($K$1*6.2307) -> 101.52586038419747 | C19: =$K$1*6.2307-B19 -> 60.472339615802525 | D19: =$B$17-B19 -> 6.0094737420611466 | E19: 890.7 | F19: =G19/H19*$B$2 -> 687.41894774136404 | G19: 692 | H19: 1467.7 | I19: 105.1 | J19: 119.5 | K19: =($I$26+$L$26-200)*B19/$B$26 -> 107.09510651631886 | L19: 9 | N19: =K19+M19-I19-L19 -> -7.0048934836811299
A20: Hotel Illness | B20: =(E20^2/(E20^2+F20^2))*($K$1*6.2307) -> 89.740422949132125 | C20: =$K$1*6.2307-B20 -> 72.257777050867873 | D20: =$B$17-B20 -> 17.794911177126494 | E20: 799.9 | F20: =G20/H20*$B$2 -> 717.76774664640197 | G20: 745 | H20: 1513.3 | I20: 93 | J20: 120 | K20: =($I$26+$L$26-200)*B20/$B$26 -> 94.663173679961517 | L20: 4.5 | N20: =K20+M20-I20-L20 -> -2.8368263200384831
A21: Generals Orders | B21: =(E21^2/(E21^2+F21^2))*($K$1*6.2307) -> 86.355152033306751 | C21: =$K$1*6.2307-B21 -> 75.643047966693246 | D21: =$B$17-B21 -> 21.180182092951867 | E21: 790.9 | F21: =G21/H21*$B$2 -> 740.22194964934363 | G21: 847 | H21: 1668.3 | I21: 107.25 | J21: 120 | K21: =($I$26+$L$26-200)*B21/$B$26 -> 91.092202225546288 | N21: =K21+M21-I21-L21 -> -16.157797774453712
A22: LB Cats | B22: =(E22^2/(E22^2+F22^2))*($K$1*6.2307) -> 80.709838190447158 | C22: =$K$1*6.2307-B22 -> 81.288361809552839 | D22: =$B$17-B22 -> 26.82549593581146 | E22: 810.7 | F22: =G22/H22*$B$2 -> 813.6003381092753 | G22: 814 | H22: 1458.7 | I22: 87.75 | J22: 115 | K22: =($I$26+$L$26-200)*B22/$B$26 -> 85.137212186247879 | L22: 7.4 | N22: =K22+M22-I22-L22 -> -10.012787813752121
A23: Bears | B23: =(E23^2/(E23^2+F23^2))*($K$1*6.2307) -> 64.883082763187744 | C23: =$K$1*6.2307-B23 -> 97.115117236812253 | D23: =$B$17-B23 -> 42.652251363070874 | E23: 725 | F23: =$B$2-H23+G23 -> 886.98379999999997 | G23: 649 | H23: 1220.0 | I23: 84.75 | J23: 120 | K23: =($I$26+$L$26-200)*B23/$B$26 -> 68.442273065555668 | L23: 2.2 | M23: -10 | N23: =K23+M23-I23-L23 -> -28.507726934444332
A24: Carrboro Hippie-Haters | B24: =(E24^2/(E24^2+F24^2))*($K$1*6.2307) -> 61.088873822048704 | C24: =$K$1*6.2307-B24 -> 100.9093261779513 | D24: =$B$17-B24 -> 46.446460304209914 | E24: 638 | F24: =$B$2-H24+G24 -> 819.98379999999997 | G24: 760 | H24: 1398.0 | I24: 108.65 | J24: 120 | K24: =($I$26+$L$26-200)*B24/$B$26 -> 64.439931108947121 | M24: -20 | N24: =K24+M24-I24-L24 -> -64.210068891052885
A26: Totals | B26: =SUM(B6:B24) -> 1420.858193185964 | C26: =SUM(C6:C24) -> 1171.1130068140362 | I26: =SUM(I6:I24) -> 1662.75 | J26: =SUM(J6:J24)-(120*16) -> 6.8500000000001364 | K26: =SUM(K6:K24) -> 1498.8 | L26: =SUM(L6:L24) -> 36.05 | M26: =SUM(M6:M24) -> 200 | N26: =SUM(N6:N24) -> -2.1316282072803006E-13
A29: Definitions:
A30: ARA: Actual Runs Allowed by your fantasy staff
A31: RA: IPRequired-IP+Actual RA (teams below IP requirement)
A32: TeamERA/9*IPRequired (teams above IP requirement)
A34: Notes:
A35: If the team with the best record is in Division 2, it will receive the $200 prize, with the first and second teams in Division 1 receiving $30 and $20, respectively.
A36: The "Fees" column is for preseason drops, or in-season drops of players with multi-year contracts.