A1: Final League Standings | J1: As of week | K1: 26
G2: Current innings pitched requirement: | K2: =$K$1*9*6.2307 -> 1457.9838
A4: Moonlight Graham Division
A5: Team | B5: W | C5: L | D5: GB | E5: RS | F5: RA | G5: ARA | H5: IP | I5: Payroll | J5: Cap | K5: Revenue | L5: Fees | M5: Prize | N5: Profit/Loss | O5: Deposit | P5: Balance
A6: Raindogs | B6: =(E6^2/(E6^2+F6^2))*($K$1*6.2307) -> 107.92585582138202 | C6: =$K$1*6.2307-B6 -> 54.072344178617982 | D6: =$B$6-B6 -> 0.0 | E6: 926.7 | F6: =G6/H6*$K$2 -> 655.93984266378595 | G6: 708 | H6: 1573.7 | I6: 134.12 | J6: 134.4 | K6: =($I$36+$L$36-$M$36)*B6/$B$36 -> 127.37382650728483 | L6: 13.1 | M6: 200 | N6: =K6+M6-I6-L6 -> 180.15382650728483 | O6: 30 | P6: =N6+O6 -> 210.15382650728483
A7: Sandman Enter Ninth | B7: =(E7^2/(E7^2+F7^2))*($K$1*6.2307) -> 71.974470842102249 | C7: =$K$1*6.2307-B7 -> 90.023729157897748 | D7: =$B$6-B7 -> 35.951384979279766 | E7: 772.8 | F7: =G7-H7+$K$2 -> 864.28379999999993 | G7: 534 | H7: 1127.7 | I7: 118.5 | J7: 120 | K7: =($I$36+$L$36-$M$36)*B7/$B$36 -> 84.944091406308658 | L7: 4.7 | N7: =K7+M7-I7-L7 -> -38.255908593691345 | O7: 36 | P7: =N7+O7 -> -2.2559085936913448
A8: Oshawa Outlaws | B8: =(E8^2/(E8^2+F8^2))*($K$1*6.2307) -> 70.694491118948491 | C8: =$K$1*6.2307-B8 -> 91.303708881051506 | D8: =$B$6-B8 -> 37.231364702433524 | E8: 703.4 | F8: =G8/H8*$K$2 -> 799.38093715801699 | G8: 992 | H8: 1809.3 | I8: 100.8 | J8: 106.55 | K8: =($I$36+$L$36-$M$36)*B8/$B$36 -> 83.433462521793203 | L8: 0.9 | N8: =K8+M8-I8-L8 -> -18.266537478206793 | O8: -14.38 | P8: =N8+O8 -> -32.646537478206795
A9: Grim Reapers | B9: =(E9^2/(E9^2+F9^2))*($K$1*6.2307) -> 67.222536060677754 | C9: =$K$1*6.2307-B9 -> 94.775663939322243 | D9: =$B$6-B9 -> 40.703319760704261 | E9: 670.2 | F9: =G9/H9*$K$2 -> 795.78435157068054 | G9: 834 | H9: 1528.0 | I9: 116.45 | J9: 120 | K9: =($I$36+$L$36-$M$36)*B9/$B$36 -> 79.33586980068317 | N9: =K9+M9-I9-L9 -> -37.114130199316833 | P9: =N9+O9 -> -37.114130199316833
A10: C-Ville Parrots | B10: =(E10^2/(E10^2+F10^2))*($K$1*6.2307) -> 60.528817479738457 | C10: =$K$1*6.2307-B10 -> 101.46938252026155 | D10: =$B$6-B10 -> 47.397038341643558 | E10: 763.3 | F10: =G10-H10+$K$2 -> 988.28379999999993 | G10: 623 | H10: 1092.7 | I10: 75.65 | J10: 120 | K10: =($I$36+$L$36-$M$36)*B10/$B$36 -> 71.435959786272747 | M10: -15 | N10: =K10+M10-I10-L10 -> -19.214040213727259 | O10: 18.65 | P10: =N10+O10 -> -0.56404021372726021
A12: Rick Vaughn Division
A13: Team | B13: W | C13: L | D13: GB | E13: RS | F13: RA | G13: ARA | H13: IP | I13: Payroll | J13: Cap | K13: Revenue | L13: Fees | M13: Prize | N13: Profit/Loss | O13: Deposit | P13: Balance
A14: Burrito Benders | B14: =(E14^2/(E14^2+F14^2))*($K$1*6.2307) -> 100.00038918135698 | C14: =$K$1*6.2307-B14 -> 61.997810818643018 | D14: =$B$14-B14 -> 0.0 | E14: 865.7 | F14: =G14/H14*$K$2 -> 681.63950077248603 | G14: 696 | H14: 1488.7 | I14: 53.85 | J14: 89 | K14: =($I$36+$L$36-$M$36)*B14/$B$36 -> 118.02021049828559 | M14: 15 | N14: =K14+M14-I14-L14 -> 79.170210498285599 | O14: 0 | P14: =N14+O14 -> 79.170210498285599
A15: LB Cats | B15: =(E15^2/(E15^2+F15^2))*($K$1*6.2307) -> 97.53658834803737 | C15: =$K$1*6.2307-B15 -> 64.461611651962627 | D15: =$B$14-B15 -> 2.4638008333196098 | E15: 911.1 | F15: =G15-H15+$K$2 -> 740.68380000000002 | G15: 725 | H15: 1442.3 | I15: 142.45 | J15: 144.55 | K15: =($I$36+$L$36-$M$36)*B15/$B$36 -> 115.11243888504829 | N15: =K15+M15-I15-L15 -> -27.337561114951697 | O15: 30 | P15: =N15+O15 -> 2.662438885048303
A16: Monroe County Cougars | B16: =(E16^2/(E16^2+F16^2))*($K$1*6.2307) -> 87.268962684038854 | C16: =$K$1*6.2307-B16 -> 74.729237315961143 | D16: =$B$14-B16 -> 12.731426497318125 | E16: 855.1 | F16: =G16-H16+$K$2 -> 791.28379999999993 | G16: 777 | H16: 1443.7 | I16: 112.75 | J16: 116.75 | K16: =($I$36+$L$36-$M$36)*B16/$B$36 -> 102.99461262354194 | N16: =K16+M16-I16-L16 -> -9.7553873764580601 | O16: 36 | P16: =N16+O16 -> 26.24461262354194
A17: BuddhaBall | B17: =(E17^2/(E17^2+F17^2))*($K$1*6.2307) -> 74.057210247298457 | C17: =$K$1*6.2307-B17 -> 87.94098975270154 | D17: =$B$14-B17 -> 25.943178934058523 | E17: 689.8 | F17: =G17-H17+$K$2 -> 751.68380000000002 | G17: 749 | H17: 1455.3 | I17: 85.5 | J17: 104.85 | K17: =($I$36+$L$36-$M$36)*B17/$B$36 -> 87.402135270203487 | N17: =K17+M17-I17-L17 -> 1.9021352702034875 | O17: 5.29 | P17: =N17+O17 -> 7.1921352702034875
A18: Paul's Pounders | B18: =(E18^2/(E18^2+F18^2))*($K$1*6.2307) -> 51.2609414511615 | C18: =$K$1*6.2307-B18 -> 110.7372585488385 | D18: =$B$14-B18 -> 48.739447730195479 | E18: 612.8 | F18: =G18-H18+$K$2 -> 900.68380000000002 | G18: 830 | H18: 1387.3 | I18: 68.35 | J18: 120 | K18: =($I$36+$L$36-$M$36)*B18/$B$36 -> 60.498035556988015 | M18: -15 | N18: =K18+M18-I18-L18 -> -22.85196444301198 | O18: 15.05 | P18: =N18+O18 -> -7.801964443011979
A20: Crash Davis Division
A21: Team | B21: W | C21: L | D21: GB | E21: RS | F21: RA | G21: ARA | H21: IP | I21: Payroll | J21: Cap | K21: Revenue | L21: Fees | M21: Prize | N21: Profit/Loss | O21: Deposit | P21: Balance
A22: Atonic Spiloman | B22: =(E22^2/(E22^2+F22^2))*($K$1*6.2307) -> 97.366449996146258 | C22: =$K$1*6.2307-B22 -> 64.631750003853739 | D22: =$B$22-B22 -> 0.0 | E22: 811.5 | F22: =G22/H22*$K$2 -> 661.16036977676015 | G22: 713 | H22: 1572.3 | I22: 156.55 | J22: 156.85 | K22: =($I$36+$L$36-$M$36)*B22/$B$36 -> 114.91164202547203 | L22: 1.7 | M22: 15 | N22: =K22+M22-I22-L22 -> -28.338357974527991 | O22: 5.87 | P22: =N22+O22 -> -22.46835797452799
A23: Philadelphia Bulldogs | B23: =(E23^2/(E23^2+F23^2))*($K$1*6.2307) -> 90.801961246835177 | C23: =$K$1*6.2307-B23 -> 71.19623875316482 | D23: =$B$22-B23 -> 6.5644887493110815 | E23: 791.3 | F23: =G23-H23+$K$2 -> 700.68380000000002 | G23: 684 | H23: 1441.3 | I23: 127.65 | J23: 128.5 | K23: =($I$36+$L$36-$M$36)*B23/$B$36 -> 107.16424873680914 | N23: =K23+M23-I23-L23 -> -20.485751263190863 | O23: 20 | P23: =N23+O23 -> -0.48575126319086337
A24: L Millz | B24: =(E24^2/(E24^2+F24^2))*($K$1*6.2307) -> 90.67608356401692 | C24: =$K$1*6.2307-B24 -> 71.322116435983077 | D24: =$B$22-B24 -> 6.6903664321293377 | E24: 938.1 | F24: =G24-H24+$K$2 -> 831.98379999999997 | G24: 747 | H24: 1373.0 | I24: 125.25 | J24: 126.95 | K24: =($I$36+$L$36-$M$36)*B24/$B$36 -> 107.01568820874655 | N24: =K24+M24-I24-L24 -> -18.234311791253447 | O24: 0 | P24: =N24+O24 -> -18.234311791253447
A25: The Unsullied | B25: =(E25^2/(E25^2+F25^2))*($K$1*6.2307) -> 75.277829673514574 | C25: =$K$1*6.2307-B25 -> 86.720370326485423 | D25: =$B$22-B25 -> 22.088620322631684 | E25: 714.1 | F25: =G25/H25*$K$2 -> 766.45392083514571 | G25: 846 | H25: 1609.3 | I25: 39.13 | J25: 98 | K25: =($I$36+$L$36-$M$36)*B25/$B$36 -> 88.842707279969019 | N25: =K25+M25-I25-L25 -> 49.712707279969017 | O25: 43.09 | P25: =N25+O25 -> 92.802707279969013
A26: Ass Man | B26: =(E26^2/(E26^2+F26^2))*($K$1*6.2307) -> 60.177134236670298 | C26: =$K$1*6.2307-B26 -> 101.8210657633297 | D26: =$B$22-B26 -> 37.18931575947596 | E26: 666.1 | F26: =G26/H26*$K$2 -> 866.44799677477158 | G26: 995 | H26: 1674.3 | I26: 106.05 | J26: 112.6 | K26: =($I$36+$L$36-$M$36)*B26/$B$36 -> 71.020904097835867 | L26: 0.8 | M26: -15 | N26: =K26+M26-I26-L26 -> -50.829095902164127 | P26: =N26+O26 -> -50.829095902164127
A28: Pedro Cerrano Division
A29: Team | B29: W | C29: L | D29: GB | E29: RS | F29: RA | G29: ARA | H29: IP | I29: Payroll | J29: Cap | K29: Revenue | L29: Fees | M29: Prize | N29: Profit/Loss | O29: Deposit | P29: Balance
A30: Alexandria Fire | B30: =(E30^2/(E30^2+F30^2))*($K$1*6.2307) -> 100.10531960416974 | C30: =$K$1*6.2307-B30 -> 61.892880395830261 | D30: =$B$30-B30 -> 0.0 | E30: 877.5 | F30: =G30-H30+$K$2 -> 689.98379999999997 | G30: 683 | H30: 1451.0 | I30: 119.5 | J30: 120 | K30: =($I$36+$L$36-$M$36)*B30/$B$36 -> 118.14404912220911 | L30: 0.6 | M30: 15 | N30: =K30+M30-I30-L30 -> 13.044049122209112 | O30: 30 | P30: =N30+O30 -> 43.04404912220911
A31: Arsenal | B31: =(E31^2/(E31^2+F31^2))*($K$1*6.2307) -> 98.127104453938443 | C31: =$K$1*6.2307-B31 -> 63.871095546061554 | D31: =$B$30-B31 -> 1.9782151502312928 | E31: 865.6 | F31: =G31/H31*$K$2 -> 698.35289617486342 | G31: 710 | H31: 1482.3 | I31: 115.05 | J31: 121 | K31: =($I$36+$L$36-$M$36)*B31/$B$36 -> 115.80936452395436 | L31: 6.6 | N31: =K31+M31-I31-L31 -> -5.8406354760456392 | P31: =N31+O31 -> -5.8406354760456392
A32: The Mayhem 5 | B32: =(E32^2/(E32^2+F32^2))*($K$1*6.2307) -> 86.094434297889791 | C32: =$K$1*6.2307-B32 -> 75.903765702110206 | D32: =$B$30-B32 -> 14.010885306279945 | E32: 848.8 | F32: =G32-H32+$K$2 -> 796.98379999999997 | G32: 754 | H32: 1415.0 | I32: 72.75 | J32: 120 | K32: =($I$36+$L$36-$M$36)*B32/$B$36 -> 101.60843714458323 | N32: =K32+M32-I32-L32 -> 28.858437144583235 | O32: 30 | P32: =N32+O32 -> 58.858437144583235
A33: Bears | B33: =(E33^2/(E33^2+F33^2))*($K$1*6.2307) -> 85.431631547389188 | C33: =$K$1*6.2307-B33 -> 76.566568452610809 | D33: =$B$30-B33 -> 14.673688056780549 | E33: 876.4 | F33: =G33-H33+$K$2 -> 829.68380000000002 | G33: 763 | H33: 1391.3 | I33: 105.95 | J33: 120 | K33: =($I$36+$L$36-$M$36)*B33/$B$36 -> 100.82619898757908 | N33: =K33+M33-I33-L33 -> -5.1238010124209268 | O33: =-57.07 -> -57.07 | P33: =N33+O33 -> -62.193801012420927
A34: Steely Blues | B34: =(E34^2/(E34^2+F34^2))*($K$1*6.2307) -> 70.586589260081524 | C34: =$K$1*6.2307-B34 -> 91.411610739918473 | D34: =$B$30-B34 -> 29.518730344088212 | E34: 740.5 | F34: =G34-H34+$K$2 -> 842.68380000000002 | G34: 658 | H34: 1273.3 | I34: 119.5 | J34: 120 | K34: =($I$36+$L$36-$M$36)*B34/$B$36 -> 83.306117016431813 | M34: -15 | N34: =K34+M34-I34-L34 -> -51.193882983568187 | O34: 50 | P34: =N34+O34 -> -1.1938829835681872
A36: Totals | B36: =SUM(B6:B34) -> 1643.1148011153941 | C36: =SUM(C6:C34) -> 1596.8491988846058 | I36: =SUM(I6:I34) -> 2095.8 | J36: =SUM(J6:J34)-(120*20) -> 0 | K36: =SUM(K6:K34) -> 1939.2 | L36: =SUM(L6:L34) -> 28.4 | M36: =SUM(M6:M34) -> 185 | N36: =SUM(N6:N34) -> 1.1368683772161603E-13
A39: Definitions:
A40: ARA: Actual Runs Allowed by your fantasy staff
A41: RA: IPRequired-IP+Actual RA (teams below IP requirement)
A42: TeamERA/9*IPRequired (teams above IP requirement)
A44: Notes:
A45: The $200 prize goes to the team with the best record in the league.
A46: The "Fees" column is for preseason drops, or in-season drops of players with multi-year contracts.
A47: The "Profit/Loss" Column shows your balance for this season only.
A48: The "Deposit" column shows your balance carried over from last season minus this season's admin fee plus any deposits paid
A49: The "Balance" column shows the amount to be paid or payable to/from each owner at season's end.
A51: Bloomington owes -51.68