A1: Official League Standings | J1: As of week | K1: 26
G2: Current innings pitched requirement: | K2: =$K$1*9*6.2307 -> 1457.9838
A4: Moonlight Graham Division
A5: Team | B5: W | C5: L | D5: GB | E5: RS | F5: RA | G5: ARA | H5: IP | I5: Payroll | J5: Tax | K5: Revenue | L5: Fees | M5: Prize | N5: Profit/Loss | O5: Deposit | P5: Balance
A6: BuddhaBall | B6: =(E6^2/(E6^2+F6^2))*($K$1*6.2307) -> 88.195839138617188 | C6: =$K$1*6.2307-B6 -> 73.802360861382809 | D6: =$B$6-B6 -> 0.0 | E6: 825 | F6: =G6-H6+$K$2 -> 754.68380000000002 | G6: 727 | H6: 1430.3 | I6: =Sheet2!AB13 -> 117.82692307692308 | J6: =Sheet2!AB14 -> 0 | K6: =($I$36+$J$36+$L$36-$M$36)*B6/$B$36 -> 118.23183791859877 | M6: 15 | N6: =K6+M6-I6-J6-L6 -> 15.404914841675705 | O6: 41 | P6: =N6+O6 -> 56.404914841675705
A7: Future Kingpins | B7: =(E7^2/(E7^2+F7^2))*($K$1*6.2307) -> 86.646764436988946 | C7: =$K$1*6.2307-B7 -> 75.351435563011051 | D7: =$B$6-B7 -> 1.5490747016282427 | E7: 800.3 | F7: =G7/H7*$K$2 -> 746.31540693641625 | G7: 797 | H7: 1557.0 | I7: =Sheet2!AB17 -> 118.86923076923084 | J7: =Sheet2!AB18 -> 0 | K7: =($I$36+$J$36+$L$36-$M$36)*B7/$B$36 -> 116.15520991850849 | L7: 17.25 | N7: =K7+M7-I7-J7-L7 -> -19.964020850722349 | O7: 28.84 | P7: =N7+O7 -> 8.8759791492776507
A8: Atonic Spiloman | B8: =(E8^2/(E8^2+F8^2))*($K$1*6.2307) -> 83.083585586251687 | C8: =$K$1*6.2307-B8 -> 78.914614413748311 | D8: =$B$6-B8 -> 5.1122535523655017 | E8: 779.8 | F8: =G8-H8+$K$2 -> 759.98379999999997 | G8: 736 | H8: 1434.0 | I8: =Sheet2!AB7 -> 121.42115384615379 | J8: =Sheet2!AB8 -> 16.557692307692314 | K8: =($I$36+$J$36+$L$36-$M$36)*B8/$B$36 -> 111.37855391670753 | L8: 1.2 | N8: =K8+M8-I8-J8-L8 -> -27.800292237138567 | O8: 2.24 | P8: =N8+O8 -> -25.560292237138569
A9: Broad Ripple Baseball Club | B9: =(E9^2/(E9^2+F9^2))*($K$1*6.2307) -> 76.730555097352507 | C9: =$K$1*6.2307-B9 -> 85.26764490264749 | D9: =$B$6-B9 -> 11.465284041264681 | E9: 769.2 | F9: =G9/H9*$K$2 -> 810.86254377942169 | G9: 827 | H9: 1487.0 | I9: =Sheet2!AB11 -> 115.18076923076927 | J9: =Sheet2!AB12 -> 0 | K9: =($I$36+$J$36+$L$36-$M$36)*B9/$B$36 -> 102.8619336499068 | N9: =K9+M9-I9-J9-L9 -> -12.318835580862469 | O9: 31 | P9: =N9+O9 -> 18.681164419137531
A10: Alexandria Fire | B10: =(E10^2/(E10^2+F10^2))*($K$1*6.2307) -> 55.564999469505871 | C10: =$K$1*6.2307-B10 -> 106.43320053049413 | D10: =$B$6-B10 -> 32.630839669111317 | E10: 657.5 | F10: =G10-H10+$K$2 -> 909.98379999999997 | G10: 703 | H10: 1251.0 | I10: =Sheet2!AB3 -> 115.8 | J10: =Sheet2!AB4 -> 0 | K10: =($I$36+$J$36+$L$36-$M$36)*B10/$B$36 -> 74.488230685126723 | L10: 4.3 | M10: -15 | N10: =K10+M10-I10-J10-L10 -> -60.611769314873314 | O10: 17.09 | P10: =N10+O10 -> -43.52176931487331
A12: Rick Vaughn Division
A13: Team | B13: W | C13: L | D13: GB | E13: RS | F13: RA | G13: ARA | H13: IP | I13: Payroll | J13: Tax | K13: Revenue | L13: Fees | M13: Prize | N13: Profit/Loss | O13: Deposit | P13: Balance
A14: Burrito Benders | B14: =(E14^2/(E14^2+F14^2))*($K$1*6.2307) -> 96.194296751441286 | C14: =$K$1*6.2307-B14 -> 65.803903248558711 | D14: =$B$14-B14 -> 0.0 | E14: 884 | F14: =G14/H14*$K$2 -> 731.14485894861195 | G14: 849 | H14: 1693.0 | I14: =Sheet2!AB15 -> 107.57692307692302 | J14: =Sheet2!AB16 -> 0 | K14: =($I$36+$J$36+$L$36-$M$36)*B14/$B$36 -> 128.95425241472813 | M14: 15 | N14: =K14+M14-I14-J14-L14 -> 36.377329337805108 | O14: 90.78 | P14: =N14+O14 -> 127.15732933780511
A15: Grim Reapers | B15: =(E15^2/(E15^2+F15^2))*($K$1*6.2307) -> 88.441969378050175 | C15: =$K$1*6.2307-B15 -> 73.556230621949823 | D15: =$B$14-B15 -> 7.7523273733911111 | E15: 752.2 | F15: =G15-H15+$K$2 -> 685.98379999999997 | G15: 609 | H15: 1381.0 | I15: =Sheet2!AB19 -> 111.25 | J15: =Sheet2!AB20 -> 0 | K15: =($I$36+$J$36+$L$36-$M$36)*B15/$B$36 -> 118.56179033880049 | N15: =K15+M15-I15-J15-L15 -> 7.3117903388004919 | O15: 45.64 | P15: =N15+O15 -> 52.951790338800492
A16: Little Jerry Seinfeld | B16: =(E16^2/(E16^2+F16^2))*($K$1*6.2307) -> 85.439087745891015 | C16: =$K$1*6.2307-B16 -> 76.559112254108982 | D16: =$B$14-B16 -> 10.75520900555027 | E16: 681.4 | F16: =G16/H16*$K$2 -> 645.01865060240959 | G16: 694 | H16: 1568.7 | I16: =Sheet2!AB25 -> 119.81153846153842 | J16: =Sheet2!AB26 -> 0 | K16: =($I$36+$J$36+$L$36-$M$36)*B16/$B$36 -> 114.53624652755369 | L16: 14.3 | N16: =K16+M16-I16-J16-L16 -> -19.575291933984733 | O16: 31.74 | P16: =N16+O16 -> 12.164708066015265
A17: LB Cats | B17: =(E17^2/(E17^2+F17^2))*($K$1*6.2307) -> 75.675025299556651 | C17: =$K$1*6.2307-B17 -> 86.323174700443346 | D17: =$B$14-B17 -> 20.519271451884634 | E17: 769.9 | F17: =G17-H17+$K$2 -> 822.28379999999993 | G17: 623 | H17: 1258.7 | I17: =Sheet2!AB23 -> 119.78653846153841 | J17: =Sheet2!AB24 -> 0.28846153846154943 | K17: =($I$36+$J$36+$L$36-$M$36)*B17/$B$36 -> 101.44693233929955 | N17: =K17+M17-I17-J17-L17 -> -18.628067660700413 | O17: 30.77 | P17: =N17+O17 -> 12.141932339299586
A18: Paul's Pounders | B18: =(E18^2/(E18^2+F18^2))*($K$1*6.2307) -> 71.156093991887559 | C18: =$K$1*6.2307-B18 -> 90.842106008112438 | D18: =$B$14-B18 -> 25.038202759553727 | E18: 654 | F18: =G18/H18*$K$2 -> 738.95041140368244 | G18: 768 | H18: 1515.3 | I18: =Sheet2!AB29 -> 75.573076923076897 | J18: =Sheet2!AB30 -> 0 | K18: =($I$36+$J$36+$L$36-$M$36)*B18/$B$36 -> 95.389032565888641 | M18: -15 | N18: =K18+M18-I18-J18-L18 -> 4.815955642811744 | O18: 31.17 | P18: =N18+O18 -> 35.985955642811746
A20: Crash Davis Division
A21: Team | B21: W | C21: L | D21: GB | E21: RS | F21: RA | G21: ARA | H21: IP | I21: Payroll | J21: Tax | K21: Revenue | L21: Fees | M21: Prize | N21: Profit/Loss | O21: Deposit | P21: Balance
A22: Arsenal | B22: =(E22^2/(E22^2+F22^2))*($K$1*6.2307) -> 112.62607703209376 | C22: =$K$1*6.2307-B22 -> 49.372122967906236 | D22: =$B$22-B22 -> 0.0 | E22: 957.1 | F22: =G22/H22*$K$2 -> 633.69275031958557 | G22: 646 | H22: 1486.3 | I22: =Sheet2!AB5 -> 112.04038461538458 | J22: =Sheet2!AB6 -> 0 | K22: =($I$36+$J$36+$L$36-$M$36)*B22/$B$36 -> 150.98204422248793 | L22: 1.2 | M22: 200 | N22: =K22+M22-I22-J22-L22 -> 237.74165960710337 | O22: 0 | P22: =N22+O22 -> 237.74165960710337
A23: Philadelphia Bulldogs | B23: =(E23^2/(E23^2+F23^2))*($K$1*6.2307) -> 106.41870920012185 | C23: =$K$1*6.2307-B23 -> 55.579490799878144 | D23: =$B$22-B23 -> 6.2073678319719079 | E23: 996.9 | F23: =G23/H23*$K$2 -> 720.44342859079518 | G23: 729 | H23: 1475.3 | I23: =Sheet2!AB31 -> 138.6 | J23: =Sheet2!AB32 -> 186 | K23: =($I$36+$J$36+$L$36-$M$36)*B23/$B$36 -> 142.6606935263701 | N23: =K23+M23-I23-J23-L23 -> -181.93930647362987 | O23: -14 | P23: =N23+O23 -> -195.93930647362987
A24: The Fightin' Rats | B24: =(E24^2/(E24^2+F24^2))*($K$1*6.2307) -> 97.349404048084693 | C24: =$K$1*6.2307-B24 -> 64.648795951915304 | D24: =$B$22-B24 -> 15.276672984009068 | E24: 890.7 | F24: =G24/H24*$K$2 -> 725.84689625419435 | G24: 727 | H24: 1460.3 | I24: =Sheet2!AB37 -> 118.91923076923075 | J24: =Sheet2!AB38 -> 0.13461538461538244 | K24: =($I$36+$J$36+$L$36-$M$36)*B24/$B$36 -> 130.50274336406517 | N24: =K24+M24-I24-J24-L24 -> 11.448897210219034 | O24: -14 | P24: =N24+O24 -> -2.5511027897809662
A25: Raindogs | B25: =(E25^2/(E25^2+F25^2))*($K$1*6.2307) -> 87.439602991736592 | C25: =$K$1*6.2307-B25 -> 74.558597008263405 | D25: =$B$22-B25 -> 25.186474040357169 | E25: 822.7 | F25: =G25/H25*$K$2 -> 759.68975972141607 | G25: 808 | H25: 1550.7 | I25: =Sheet2!AB33 -> 117.27500000000001 | J25: =Sheet2!AB34 -> 0 | K25: =($I$36+$J$36+$L$36-$M$36)*B25/$B$36 -> 117.21805778543803 | L25: 5.7 | N25: =K25+M25-I25-J25-L25 -> -5.7569422145619997 | O25: 35.33 | P25: =N25+O25 -> 29.573057785437999
A26: Bears | B26: =(E26^2/(E26^2+F26^2))*($K$1*6.2307) -> 69.567533612499531 | C26: =$K$1*6.2307-B26 -> 92.430666387500466 | D26: =$B$22-B26 -> 43.05854341959423 | E26: 700.1 | F26: =G26-H26+$K$2 -> 806.98379999999997 | G26: 769 | H26: 1420.0 | I26: =Sheet2!AB9 -> 99.326923076923066 | J26: =Sheet2!AB10 -> 0 | K26: =($I$36+$J$36+$L$36-$M$36)*B26/$B$36 -> 93.259471634964001 | L26: 0.6 | M26: -15 | N26: =K26+M26-I26-J26-L26 -> -21.667451441959066 | O26: 30.77 | P26: =N26+O26 -> 9.1025485580409331
A28: Pedro Cerrano Division
A29: Team | B29: W | C29: L | D29: GB | E29: RS | F29: RA | G29: ARA | H29: IP | I29: Payroll | J29: Tax | K29: Revenue | L29: Fees | M29: Prize | N29: Profit/Loss | O29: Deposit | P29: Balance
A30: Steely Blues | B30: =(E30^2/(E30^2+F30^2))*($K$1*6.2307) -> 99.489742843977425 | C30: =$K$1*6.2307-B30 -> 62.508457156022573 | D30: =$B$30-B30 -> 0.0 | E30: 807.4 | F30: =G30-H30+$K$2 -> 639.98379999999997 | G30: 615 | H30: 1433.0 | I30: =Sheet2!AB35 -> 119.1538461538462 | J30: =Sheet2!AB36 -> 0 | K30: =($I$36+$J$36+$L$36-$M$36)*B30/$B$36 -> 133.37199651793733 | M30: 15 | N30: =K30+M30-I30-J30-L30 -> 29.21815036409113 | O30: 13.58 | P30: =N30+O30 -> 42.798150364091128
A31: Monroe County Cougars | B31: =(E31^2/(E31^2+F31^2))*($K$1*6.2307) -> 89.557239836730488 | C31: =$K$1*6.2307-B31 -> 72.440960163269509 | D31: =$B$30-B31 -> 9.932503007246936 | E31: 840.9 | F31: =G31/H31*$K$2 -> 756.28607035977905 | G31: 780 | H31: 1503.7 | I31: =Sheet2!AB27 -> 120.12884615384618 | J31: =Sheet2!AB28 -> 3.2115384615384595 | K31: =($I$36+$J$36+$L$36-$M$36)*B31/$B$36 -> 120.05687760588627 | N31: =K31+M31-I31-J31-L31 -> -3.2835070094983716 | O31: 33.49 | P31: =N31+O31 -> 30.20649299050163
A32: L Millz | B32: =(E32^2/(E32^2+F32^2))*($K$1*6.2307) -> 85.536875457813025 | C32: =$K$1*6.2307-B32 -> 76.461324542186972 | D32: =$B$30-B32 -> 13.952867386164399 | E32: 752.9 | F32: =G32/H32*$K$2 -> 711.83856784430736 | G32: 720 | H32: 1474.7 | I32: =Sheet2!AB21 -> 117.62884615384611 | J32: =Sheet2!AB22 -> 0 | K32: =($I$36+$J$36+$L$36-$M$36)*B32/$B$36 -> 114.66733684903951 | N32: =K32+M32-I32-J32-L32 -> -2.9615093048065972 | O32: 15.75 | P32: =N32+O32 -> 12.788490695193403
A33: The Mayhem 5 | B33: =(E33^2/(E33^2+F33^2))*($K$1*6.2307) -> 66.685746207148 | C33: =$K$1*6.2307-B33 -> 95.312453792851997 | D33: =$B$30-B33 -> 32.803996636829424 | E33: 669.4 | F33: =G33-H33+$K$2 -> 800.28379999999993 | G33: 774 | H33: 1431.7 | I33: =Sheet2!AB39 -> 83.573076923076911 | J33: =Sheet2!AB40 -> 0 | K33: =($I$36+$J$36+$L$36-$M$36)*B33/$B$36 -> 89.396261933088212 | N33: =K33+M33-I33-J33-L33 -> 5.8231850100113007 | O33: 54.77 | P33: =N33+O33 -> 60.593185010011304
A34: The Unsullied | B34: =(E34^2/(E34^2+F34^2))*($K$1*6.2307) -> 61.182596311736603 | C34: =$K$1*6.2307-B34 -> 100.81560368826339 | D34: =$B$30-B34 -> 38.307146532240822 | E34: 675.4 | F34: =G34-H34+$K$2 -> 866.98379999999997 | G34: 685 | H34: 1276.0 | I34: =Sheet2!AB41 -> 40.653846153846153 | J34: =Sheet2!AB42 -> 0 | K34: =($I$36+$J$36+$L$36-$M$36)*B34/$B$36 -> 82.018957824065424 | M34: -15 | N34: =K34+M34-I34-J34-L34 -> 26.365111670219271 | O34: 123.65 | P34: =N34+O34 -> 150.01511167021928
A36: Totals | B36: =SUM(B6:B34) -> 1682.9817444374853 | C36: =SUM(C6:C34) -> 1556.9822555625149 | I36: =SUM(I6:I34) -> 2190.3961538461535 | J36: =SUM(J6:J34) -> 206.19230769230768 | K36: =SUM(K6:K34) -> 2256.1384615384613 | L36: =SUM(L6:L34) -> 44.55 | M36: =SUM(M6:M34) -> 185 | N36: =SUM(N6:N34) -> -5.8264504332328215E-13
A39: Definitions:
A40: ARA: Actual Runs Allowed by your fantasy staff
A41: RA: IPRequired-IP+Actual RA (teams below IP requirement)
A42: TeamERA/9*IPRequired (teams above IP requirement)
A44: Notes:
A45: The $200 prize goes to the team with the best record in the league.
A46: The "Fees" column is for preseason or in-season drops of players with multi-year contracts.
A47: The "Profit/Loss" Column shows your balance for this season only.
A48: The "Deposit" column shows your balance carried over from last season minus this season's admin fee plus any deposits paid
A49: The "Balance" column shows the amount to be paid or payable to/from each owner at season's end.