A2: Team | B2: 1 | C2: 2 | D2: 3 | E2: 4 | F2: 5 | G2: 6 | H2: 7 | I2: 8 | J2: 9 | K2: 10 | L2: 11 | M2: 12 | N2: 13 | O2: 14 | P2: 15 | Q2: 16 | R2: 17 | S2: 18 | T2: 19 | U2: 20 | V2: 21 | W2: 22 | X2: 23 | Y2: 24 | Z2: 25 | AA2: 26 | AB2: Payroll
A3: Alexandria Fire | B3: 115.25 | C3: 115.25 | D3: 115.25 | E3: 115.25 | F3: 115.25 | G3: 115.25 | H3: 115.7 | I3: 115.7 | J3: 116.5 | K3: 113.6 | L3: 115.1 | M3: 115.1 | N3: 115.1 | O3: 115.1 | P3: 115.95 | Q3: 115.95 | R3: 116.55 | S3: 116.55 | T3: 116.55 | U3: 116.55 | V3: 116.55 | W3: 116.55 | X3: 116.55 | Y3: 116.55 | Z3: 116.55 | AA3: 116.55 | AB3: =SUM(B3:AA3)/26 -> 115.8
B4: =IF(B3>120,(B3-120)/26*10,0) -> 0 | C4: =IF(C3>120,(C3-120)/26*10,0) -> 0 | D4: =IF(D3>120,(D3-120)/26*10,0) -> 0 | E4: =IF(E3>120,(E3-120)/26*10,0) -> 0 | F4: =IF(F3>120,(F3-120)/26*10,0) -> 0 | G4: =IF(G3>120,(G3-120)/26*10,0) -> 0 | H4: =IF(H3>120,(H3-120)/26*10,0) -> 0 | I4: =IF(I3>120,(I3-120)/26*10,0) -> 0 | J4: =IF(J3>120,(J3-120)/26*10,0) -> 0 | K4: =IF(K3>120,(K3-120)/26*10,0) -> 0 | L4: =IF(L3>120,(L3-120)/26*10,0) -> 0 | M4: =IF(M3>120,(M3-120)/26*10,0) -> 0 | N4: =IF(N3>120,(N3-120)/26*10,0) -> 0 | O4: =IF(O3>120,(O3-120)/26*10,0) -> 0 | P4: =IF(P3>120,(P3-120)/26*10,0) -> 0 | Q4: =IF(Q3>120,(Q3-120)/26*10,0) -> 0 | R4: =IF(R3>120,(R3-120)/26*10,0) -> 0 | S4: =IF(S3>120,(S3-120)/26*10,0) -> 0 | T4: =IF(T3>120,(T3-120)/26*10,0) -> 0 | U4: =IF(U3>120,(U3-120)/26*10,0) -> 0 | V4: =IF(V3>120,(V3-120)/26*10,0) -> 0 | W4: =IF(W3>120,(W3-120)/26*10,0) -> 0 | X4: =IF(X3>120,(X3-120)/26*10,0) -> 0 | Y4: =IF(Y3>120,(Y3-120)/26*10,0) -> 0 | Z4: =IF(Z3>120,(Z3-120)/26*10,0) -> 0 | AA4: =IF(AA3>120,(AA3-120)/26*10,0) -> 0 | AB4: =SUM(B4:AA4) -> 0
A5: Arsenal | B5: 104.8 | C5: 113.35 | D5: 113.35 | E5: 110.4 | F5: 110.4 | G5: 110.9 | H5: 110.9 | I5: 110.9 | J5: 111.95 | K5: 111.95 | L5: 112.25 | M5: 112.25 | N5: 112.85 | O5: 112.3 | P5: 112.3 | Q5: 112.3 | R5: 112.3 | S5: 112.6 | T5: 112.6 | U5: 112.6 | V5: 112.6 | W5: 113.2 | X5: 113.5 | Y5: 113.5 | Z5: 113.5 | AA5: 113.5 | AB5: =SUM(B5:AA5)/26 -> 112.04038461538458
B6: =IF(B5>120,(B5-120)/26*10,0) -> 0 | C6: =IF(C5>120,(C5-120)/26*10,0) -> 0 | D6: =IF(D5>120,(D5-120)/26*10,0) -> 0 | E6: =IF(E5>120,(E5-120)/26*10,0) -> 0 | F6: =IF(F5>120,(F5-120)/26*10,0) -> 0 | G6: =IF(G5>120,(G5-120)/26*10,0) -> 0 | H6: =IF(H5>120,(H5-120)/26*10,0) -> 0 | I6: =IF(I5>120,(I5-120)/26*10,0) -> 0 | J6: =IF(J5>120,(J5-120)/26*10,0) -> 0 | K6: =IF(K5>120,(K5-120)/26*10,0) -> 0 | L6: =IF(L5>120,(L5-120)/26*10,0) -> 0 | M6: =IF(M5>120,(M5-120)/26*10,0) -> 0 | N6: =IF(N5>120,(N5-120)/26*10,0) -> 0 | O6: =IF(O5>120,(O5-120)/26*10,0) -> 0 | P6: =IF(P5>120,(P5-120)/26*10,0) -> 0 | Q6: =IF(Q5>120,(Q5-120)/26*10,0) -> 0 | R6: =IF(R5>120,(R5-120)/26*10,0) -> 0 | S6: =IF(S5>120,(S5-120)/26*10,0) -> 0 | T6: =IF(T5>120,(T5-120)/26*10,0) -> 0 | U6: =IF(U5>120,(U5-120)/26*10,0) -> 0 | V6: =IF(V5>120,(V5-120)/26*10,0) -> 0 | W6: =IF(W5>120,(W5-120)/26*10,0) -> 0 | X6: =IF(X5>120,(X5-120)/26*10,0) -> 0 | Y6: =IF(Y5>120,(Y5-120)/26*10,0) -> 0 | Z6: =IF(Z5>120,(Z5-120)/26*10,0) -> 0 | AA6: =IF(AA5>120,(AA5-120)/26*10,0) -> 0 | AB6: =SUM(B6:AA6) -> 0
A7: Atonic Spiloman | B7: 121.05 | C7: 119.2 | D7: 120.6 | E7: 119.15 | F7: 119.15 | G7: 120 | H7: 118.3 | I7: 118.3 | J7: 119.8 | K7: 123 | L7: 123 | M7: 123 | N7: 123 | O7: 123 | P7: 122.2 | Q7: 122.2 | R7: 122.2 | S7: 122.2 | T7: 122.2 | U7: 122.2 | V7: 122.2 | W7: 122.2 | X7: 122.2 | Y7: 122.2 | Z7: 122.2 | AA7: 122.2 | AB7: =SUM(B7:AA7)/26 -> 121.42115384615379
B8: =IF(B7>120,(B7-120)/26*10,0) -> 0.40384615384615274 | C8: =IF(C7>120,(C7-120)/26*10,0) -> 0 | D8: =IF(D7>120,(D7-120)/26*10,0) -> 0.23076923076922859 | E8: =IF(E7>120,(E7-120)/26*10,0) -> 0 | F8: =IF(F7>120,(F7-120)/26*10,0) -> 0 | G8: =IF(G7>120,(G7-120)/26*10,0) -> 0 | H8: =IF(H7>120,(H7-120)/26*10,0) -> 0 | I8: =IF(I7>120,(I7-120)/26*10,0) -> 0 | J8: =IF(J7>120,(J7-120)/26*10,0) -> 0 | K8: =IF(K7>120,(K7-120)/26*10,0) -> 1.153846153846154 | L8: =IF(L7>120,(L7-120)/26*10,0) -> 1.153846153846154 | M8: =IF(M7>120,(M7-120)/26*10,0) -> 1.153846153846154 | N8: =IF(N7>120,(N7-120)/26*10,0) -> 1.153846153846154 | O8: =IF(O7>120,(O7-120)/26*10,0) -> 1.153846153846154 | P8: =IF(P7>120,(P7-120)/26*10,0) -> 0.84615384615384737 | Q8: =IF(Q7>120,(Q7-120)/26*10,0) -> 0.84615384615384737 | R8: =IF(R7>120,(R7-120)/26*10,0) -> 0.84615384615384737 | S8: =IF(S7>120,(S7-120)/26*10,0) -> 0.84615384615384737 | T8: =IF(T7>120,(T7-120)/26*10,0) -> 0.84615384615384737 | U8: =IF(U7>120,(U7-120)/26*10,0) -> 0.84615384615384737 | V8: =IF(V7>120,(V7-120)/26*10,0) -> 0.84615384615384737 | W8: =IF(W7>120,(W7-120)/26*10,0) -> 0.84615384615384737 | X8: =IF(X7>120,(X7-120)/26*10,0) -> 0.84615384615384737 | Y8: =IF(Y7>120,(Y7-120)/26*10,0) -> 0.84615384615384737 | Z8: =IF(Z7>120,(Z7-120)/26*10,0) -> 0.84615384615384737 | AA8: =IF(AA7>120,(AA7-120)/26*10,0) -> 0.84615384615384737 | AB8: =SUM(B8:AA8) -> 16.557692307692314
A9: Bears | B9: 95.3 | C9: 97 | D9: 97 | E9: 97 | F9: 97 | G9: 97 | H9: 97 | I9: 97 | J9: 97 | K9: 97 | L9: 98.5 | M9: 98.5 | N9: 98.5 | O9: 98.5 | P9: 98.5 | Q9: 98.5 | R9: 101.6 | S9: 101.6 | T9: 101.6 | U9: 101.6 | V9: 101.6 | W9: 101.6 | X9: 101.6 | Y9: 104 | Z9: 104 | AA9: 104 | AB9: =SUM(B9:AA9)/26 -> 99.326923076923066
B10: =IF(B9>120,(B9-120)/26*10,0) -> 0 | C10: =IF(C9>120,(C9-120)/26*10,0) -> 0 | D10: =IF(D9>120,(D9-120)/26*10,0) -> 0 | E10: =IF(E9>120,(E9-120)/26*10,0) -> 0 | F10: =IF(F9>120,(F9-120)/26*10,0) -> 0 | G10: =IF(G9>120,(G9-120)/26*10,0) -> 0 | H10: =IF(H9>120,(H9-120)/26*10,0) -> 0 | I10: =IF(I9>120,(I9-120)/26*10,0) -> 0 | J10: =IF(J9>120,(J9-120)/26*10,0) -> 0 | K10: =IF(K9>120,(K9-120)/26*10,0) -> 0 | L10: =IF(L9>120,(L9-120)/26*10,0) -> 0 | M10: =IF(M9>120,(M9-120)/26*10,0) -> 0 | N10: =IF(N9>120,(N9-120)/26*10,0) -> 0 | O10: =IF(O9>120,(O9-120)/26*10,0) -> 0 | P10: =IF(P9>120,(P9-120)/26*10,0) -> 0 | Q10: =IF(Q9>120,(Q9-120)/26*10,0) -> 0 | R10: =IF(R9>120,(R9-120)/26*10,0) -> 0 | S10: =IF(S9>120,(S9-120)/26*10,0) -> 0 | T10: =IF(T9>120,(T9-120)/26*10,0) -> 0 | U10: =IF(U9>120,(U9-120)/26*10,0) -> 0 | V10: =IF(V9>120,(V9-120)/26*10,0) -> 0 | W10: =IF(W9>120,(W9-120)/26*10,0) -> 0 | X10: =IF(X9>120,(X9-120)/26*10,0) -> 0 | Y10: =IF(Y9>120,(Y9-120)/26*10,0) -> 0 | Z10: =IF(Z9>120,(Z9-120)/26*10,0) -> 0 | AA10: =IF(AA9>120,(AA9-120)/26*10,0) -> 0 | AB10: =SUM(B10:AA10) -> 0
A11: Broad Ripple Baseball Club | B11: 113 | C11: 113.3 | D11: 113.3 | E11: 113.3 | F11: 113.3 | G11: 113.3 | H11: 113.6 | I11: 113.6 | J11: 113.6 | K11: 113.6 | L11: 116.3 | M11: 116.3 | N11: 116.3 | O11: 116.3 | P11: 116.3 | Q11: 116.3 | R11: 116.3 | S11: 116.3 | T11: 116.3 | U11: 116.3 | V11: 116.3 | W11: 116.3 | X11: 116.3 | Y11: 116.3 | Z11: 116.3 | AA11: 116.3 | AB11: =SUM(B11:AA11)/26 -> 115.18076923076927
B12: =IF(B11>120,(B11-120)/26*10,0) -> 0 | C12: =IF(C11>120,(C11-120)/26*10,0) -> 0 | D12: =IF(D11>120,(D11-120)/26*10,0) -> 0 | E12: =IF(E11>120,(E11-120)/26*10,0) -> 0 | F12: =IF(F11>120,(F11-120)/26*10,0) -> 0 | G12: =IF(G11>120,(G11-120)/26*10,0) -> 0 | H12: =IF(H11>120,(H11-120)/26*10,0) -> 0 | I12: =IF(I11>120,(I11-120)/26*10,0) -> 0 | J12: =IF(J11>120,(J11-120)/26*10,0) -> 0 | K12: =IF(K11>120,(K11-120)/26*10,0) -> 0 | L12: =IF(L11>120,(L11-120)/26*10,0) -> 0 | M12: =IF(M11>120,(M11-120)/26*10,0) -> 0 | N12: =IF(N11>120,(N11-120)/26*10,0) -> 0 | O12: =IF(O11>120,(O11-120)/26*10,0) -> 0 | P12: =IF(P11>120,(P11-120)/26*10,0) -> 0 | Q12: =IF(Q11>120,(Q11-120)/26*10,0) -> 0 | R12: =IF(R11>120,(R11-120)/26*10,0) -> 0 | S12: =IF(S11>120,(S11-120)/26*10,0) -> 0 | T12: =IF(T11>120,(T11-120)/26*10,0) -> 0 | U12: =IF(U11>120,(U11-120)/26*10,0) -> 0 | V12: =IF(V11>120,(V11-120)/26*10,0) -> 0 | W12: =IF(W11>120,(W11-120)/26*10,0) -> 0 | X12: =IF(X11>120,(X11-120)/26*10,0) -> 0 | Y12: =IF(Y11>120,(Y11-120)/26*10,0) -> 0 | Z12: =IF(Z11>120,(Z11-120)/26*10,0) -> 0 | AA12: =IF(AA11>120,(AA11-120)/26*10,0) -> 0 | AB12: =SUM(B12:AA12) -> 0
A13: BuddhaBall | B13: 116.5 | C13: 116.5 | D13: 116.5 | E13: 118 | F13: 118 | G13: 118 | H13: 118 | I13: 118 | J13: 118 | K13: 118 | L13: 118 | M13: 118 | N13: 118 | O13: 118 | P13: 118 | Q13: 118 | R13: 118 | S13: 118 | T13: 118 | U13: 118 | V13: 118 | W13: 118 | X13: 118 | Y13: 118 | Z13: 118 | AA13: 118 | AB13: =SUM(B13:AA13)/26 -> 117.82692307692308
B14: =IF(B13>120,(B13-120)/26*10,0) -> 0 | C14: =IF(C13>120,(C13-120)/26*10,0) -> 0 | D14: =IF(D13>120,(D13-120)/26*10,0) -> 0 | E14: =IF(E13>120,(E13-120)/26*10,0) -> 0 | F14: =IF(F13>120,(F13-120)/26*10,0) -> 0 | G14: =IF(G13>120,(G13-120)/26*10,0) -> 0 | H14: =IF(H13>120,(H13-120)/26*10,0) -> 0 | I14: =IF(I13>120,(I13-120)/26*10,0) -> 0 | J14: =IF(J13>120,(J13-120)/26*10,0) -> 0 | K14: =IF(K13>120,(K13-120)/26*10,0) -> 0 | L14: =IF(L13>120,(L13-120)/26*10,0) -> 0 | M14: =IF(M13>120,(M13-120)/26*10,0) -> 0 | N14: =IF(N13>120,(N13-120)/26*10,0) -> 0 | O14: =IF(O13>120,(O13-120)/26*10,0) -> 0 | P14: =IF(P13>120,(P13-120)/26*10,0) -> 0 | Q14: =IF(Q13>120,(Q13-120)/26*10,0) -> 0 | R14: =IF(R13>120,(R13-120)/26*10,0) -> 0 | S14: =IF(S13>120,(S13-120)/26*10,0) -> 0 | T14: =IF(T13>120,(T13-120)/26*10,0) -> 0 | U14: =IF(U13>120,(U13-120)/26*10,0) -> 0 | V14: =IF(V13>120,(V13-120)/26*10,0) -> 0 | W14: =IF(W13>120,(W13-120)/26*10,0) -> 0 | X14: =IF(X13>120,(X13-120)/26*10,0) -> 0 | Y14: =IF(Y13>120,(Y13-120)/26*10,0) -> 0 | Z14: =IF(Z13>120,(Z13-120)/26*10,0) -> 0 | AA14: =IF(AA13>120,(AA13-120)/26*10,0) -> 0 | AB14: =SUM(B14:AA14) -> 0
A15: Burrito Benders | B15: 107.5 | C15: 107.5 | D15: 107.5 | E15: 107.5 | F15: 107.5 | G15: 107.5 | H15: 107.6 | I15: 107.6 | J15: 107.6 | K15: 107.6 | L15: 107.6 | M15: 107.6 | N15: 107.6 | O15: 107.6 | P15: 107.6 | Q15: 107.6 | R15: 107.6 | S15: 107.6 | T15: 107.6 | U15: 107.6 | V15: 107.6 | W15: 107.6 | X15: 107.6 | Y15: 107.6 | Z15: 107.6 | AA15: 107.6 | AB15: =SUM(B15:AA15)/26 -> 107.57692307692302
B16: =IF(B15>120,(B15-120)/26*10,0) -> 0 | C16: =IF(C15>120,(C15-120)/26*10,0) -> 0 | D16: =IF(D15>120,(D15-120)/26*10,0) -> 0 | E16: =IF(E15>120,(E15-120)/26*10,0) -> 0 | F16: =IF(F15>120,(F15-120)/26*10,0) -> 0 | G16: =IF(G15>120,(G15-120)/26*10,0) -> 0 | H16: =IF(H15>120,(H15-120)/26*10,0) -> 0 | I16: =IF(I15>120,(I15-120)/26*10,0) -> 0 | J16: =IF(J15>120,(J15-120)/26*10,0) -> 0 | K16: =IF(K15>120,(K15-120)/26*10,0) -> 0 | L16: =IF(L15>120,(L15-120)/26*10,0) -> 0 | M16: =IF(M15>120,(M15-120)/26*10,0) -> 0 | N16: =IF(N15>120,(N15-120)/26*10,0) -> 0 | O16: =IF(O15>120,(O15-120)/26*10,0) -> 0 | P16: =IF(P15>120,(P15-120)/26*10,0) -> 0 | Q16: =IF(Q15>120,(Q15-120)/26*10,0) -> 0 | R16: =IF(R15>120,(R15-120)/26*10,0) -> 0 | S16: =IF(S15>120,(S15-120)/26*10,0) -> 0 | T16: =IF(T15>120,(T15-120)/26*10,0) -> 0 | U16: =IF(U15>120,(U15-120)/26*10,0) -> 0 | V16: =IF(V15>120,(V15-120)/26*10,0) -> 0 | W16: =IF(W15>120,(W15-120)/26*10,0) -> 0 | X16: =IF(X15>120,(X15-120)/26*10,0) -> 0 | Y16: =IF(Y15>120,(Y15-120)/26*10,0) -> 0 | Z16: =IF(Z15>120,(Z15-120)/26*10,0) -> 0 | AA16: =IF(AA15>120,(AA15-120)/26*10,0) -> 0 | AB16: =SUM(B16:AA16) -> 0
A17: Future Kingpins | B17: 118.85 | C17: 118.85 | D17: 118.85 | E17: 118.85 | F17: 118.85 | G17: 118.85 | H17: 118.85 | I17: 118.85 | J17: 119.15 | K17: 119.15 | L17: 118.65 | M17: 118.65 | N17: 118.95 | O17: 119.65 | P17: 118.8 | Q17: 118.8 | R17: 118.8 | S17: 118.8 | T17: 118.8 | U17: 118.8 | V17: 118.8 | W17: 118.8 | X17: 118.8 | Y17: 118.8 | Z17: 118.8 | AA17: 118.8 | AB17: =SUM(B17:AA17)/26 -> 118.86923076923084
B18: =IF(B17>120,(B17-120)/26*10,0) -> 0 | C18: =IF(C17>120,(C17-120)/26*10,0) -> 0 | D18: =IF(D17>120,(D17-120)/26*10,0) -> 0 | E18: =IF(E17>120,(E17-120)/26*10,0) -> 0 | F18: =IF(F17>120,(F17-120)/26*10,0) -> 0 | G18: =IF(G17>120,(G17-120)/26*10,0) -> 0 | H18: =IF(H17>120,(H17-120)/26*10,0) -> 0 | I18: =IF(I17>120,(I17-120)/26*10,0) -> 0 | J18: =IF(J17>120,(J17-120)/26*10,0) -> 0 | K18: =IF(K17>120,(K17-120)/26*10,0) -> 0 | L18: =IF(L17>120,(L17-120)/26*10,0) -> 0 | M18: =IF(M17>120,(M17-120)/26*10,0) -> 0 | N18: =IF(N17>120,(N17-120)/26*10,0) -> 0 | O18: =IF(O17>120,(O17-120)/26*10,0) -> 0 | P18: =IF(P17>120,(P17-120)/26*10,0) -> 0 | Q18: =IF(Q17>120,(Q17-120)/26*10,0) -> 0 | R18: =IF(R17>120,(R17-120)/26*10,0) -> 0 | S18: =IF(S17>120,(S17-120)/26*10,0) -> 0 | T18: =IF(T17>120,(T17-120)/26*10,0) -> 0 | U18: =IF(U17>120,(U17-120)/26*10,0) -> 0 | V18: =IF(V17>120,(V17-120)/26*10,0) -> 0 | W18: =IF(W17>120,(W17-120)/26*10,0) -> 0 | X18: =IF(X17>120,(X17-120)/26*10,0) -> 0 | Y18: =IF(Y17>120,(Y17-120)/26*10,0) -> 0 | Z18: =IF(Z17>120,(Z17-120)/26*10,0) -> 0 | AA18: =IF(AA17>120,(AA17-120)/26*10,0) -> 0 | AB18: =SUM(B18:AA18) -> 0
A19: Grim Reapers | B19: 111.25 | C19: 111.25 | D19: 111.25 | E19: 111.25 | F19: 111.25 | G19: 111.25 | H19: 111.25 | I19: 111.25 | J19: 111.25 | K19: 111.25 | L19: 111.25 | M19: 111.25 | N19: 111.25 | O19: 111.25 | P19: 111.25 | Q19: 111.25 | R19: 111.25 | S19: 111.25 | T19: 111.25 | U19: 111.25 | V19: 111.25 | W19: 111.25 | X19: 111.25 | Y19: 111.25 | Z19: 111.25 | AA19: 111.25 | AB19: =SUM(B19:AA19)/26 -> 111.25
B20: =IF(B19>120,(B19-120)/26*10,0) -> 0 | C20: =IF(C19>120,(C19-120)/26*10,0) -> 0 | D20: =IF(D19>120,(D19-120)/26*10,0) -> 0 | E20: =IF(E19>120,(E19-120)/26*10,0) -> 0 | F20: =IF(F19>120,(F19-120)/26*10,0) -> 0 | G20: =IF(G19>120,(G19-120)/26*10,0) -> 0 | H20: =IF(H19>120,(H19-120)/26*10,0) -> 0 | I20: =IF(I19>120,(I19-120)/26*10,0) -> 0 | J20: =IF(J19>120,(J19-120)/26*10,0) -> 0 | K20: =IF(K19>120,(K19-120)/26*10,0) -> 0 | L20: =IF(L19>120,(L19-120)/26*10,0) -> 0 | M20: =IF(M19>120,(M19-120)/26*10,0) -> 0 | N20: =IF(N19>120,(N19-120)/26*10,0) -> 0 | O20: =IF(O19>120,(O19-120)/26*10,0) -> 0 | P20: =IF(P19>120,(P19-120)/26*10,0) -> 0 | Q20: =IF(Q19>120,(Q19-120)/26*10,0) -> 0 | R20: =IF(R19>120,(R19-120)/26*10,0) -> 0 | S20: =IF(S19>120,(S19-120)/26*10,0) -> 0 | T20: =IF(T19>120,(T19-120)/26*10,0) -> 0 | U20: =IF(U19>120,(U19-120)/26*10,0) -> 0 | V20: =IF(V19>120,(V19-120)/26*10,0) -> 0 | W20: =IF(W19>120,(W19-120)/26*10,0) -> 0 | X20: =IF(X19>120,(X19-120)/26*10,0) -> 0 | Y20: =IF(Y19>120,(Y19-120)/26*10,0) -> 0 | Z20: =IF(Z19>120,(Z19-120)/26*10,0) -> 0 | AA20: =IF(AA19>120,(AA19-120)/26*10,0) -> 0 | AB20: =SUM(B20:AA20) -> 0
A21: L Millz | B21: 114.65 | C21: 114.65 | D21: 114.65 | E21: 117.9 | F21: 117.9 | G21: 117.9 | H21: 117.9 | I21: 117.9 | J21: 117.9 | K21: 117.9 | L21: 117.9 | M21: 117.9 | N21: 117.9 | O21: 117.9 | P21: 117.9 | Q21: 117.9 | R21: 117.9 | S21: 118.2 | T21: 118.2 | U21: 118.2 | V21: 118.2 | W21: 118.2 | X21: 118.2 | Y21: 118.2 | Z21: 118.2 | AA21: 118.2 | AB21: =SUM(B21:AA21)/26 -> 117.62884615384611
B22: =IF(B21>120,(B21-120)/26*10,0) -> 0 | C22: =IF(C21>120,(C21-120)/26*10,0) -> 0 | D22: =IF(D21>120,(D21-120)/26*10,0) -> 0 | E22: =IF(E21>120,(E21-120)/26*10,0) -> 0 | F22: =IF(F21>120,(F21-120)/26*10,0) -> 0 | G22: =IF(G21>120,(G21-120)/26*10,0) -> 0 | H22: =IF(H21>120,(H21-120)/26*10,0) -> 0 | I22: =IF(I21>120,(I21-120)/26*10,0) -> 0 | J22: =IF(J21>120,(J21-120)/26*10,0) -> 0 | K22: =IF(K21>120,(K21-120)/26*10,0) -> 0 | L22: =IF(L21>120,(L21-120)/26*10,0) -> 0 | M22: =IF(M21>120,(M21-120)/26*10,0) -> 0 | N22: =IF(N21>120,(N21-120)/26*10,0) -> 0 | O22: =IF(O21>120,(O21-120)/26*10,0) -> 0 | P22: =IF(P21>120,(P21-120)/26*10,0) -> 0 | Q22: =IF(Q21>120,(Q21-120)/26*10,0) -> 0 | R22: =IF(R21>120,(R21-120)/26*10,0) -> 0 | S22: =IF(S21>120,(S21-120)/26*10,0) -> 0 | T22: =IF(T21>120,(T21-120)/26*10,0) -> 0 | U22: =IF(U21>120,(U21-120)/26*10,0) -> 0 | V22: =IF(V21>120,(V21-120)/26*10,0) -> 0 | W22: =IF(W21>120,(W21-120)/26*10,0) -> 0 | X22: =IF(X21>120,(X21-120)/26*10,0) -> 0 | Y22: =IF(Y21>120,(Y21-120)/26*10,0) -> 0 | Z22: =IF(Z21>120,(Z21-120)/26*10,0) -> 0 | AA22: =IF(AA21>120,(AA21-120)/26*10,0) -> 0 | AB22: =SUM(B22:AA22) -> 0
A23: LB Cats | B23: 120.15 | C23: 120.15 | D23: 120.15 | E23: 120.15 | F23: 120.15 | G23: 119.7 | H23: 119.7 | I23: 119.7 | J23: 119.7 | K23: 119.7 | L23: 119.7 | M23: 119.7 | N23: 119.7 | O23: 119.7 | P23: 119.7 | Q23: 119.7 | R23: 119.7 | S23: 119.7 | T23: 119.7 | U23: 119.7 | V23: 119.7 | W23: 119.7 | X23: 119.7 | Y23: 119.7 | Z23: 119.7 | AA23: 119.7 | AB23: =SUM(B23:AA23)/26 -> 119.78653846153841
B24: =IF(B23>120,(B23-120)/26*10,0) -> 5.7692307692309881E-2 | C24: =IF(C23>120,(C23-120)/26*10,0) -> 5.7692307692309881E-2 | D24: =IF(D23>120,(D23-120)/26*10,0) -> 5.7692307692309881E-2 | E24: =IF(E23>120,(E23-120)/26*10,0) -> 5.7692307692309881E-2 | F24: =IF(F23>120,(F23-120)/26*10,0) -> 5.7692307692309881E-2 | G24: =IF(G23>120,(G23-120)/26*10,0) -> 0 | H24: =IF(H23>120,(H23-120)/26*10,0) -> 0 | I24: =IF(I23>120,(I23-120)/26*10,0) -> 0 | J24: =IF(J23>120,(J23-120)/26*10,0) -> 0 | K24: =IF(K23>120,(K23-120)/26*10,0) -> 0 | L24: =IF(L23>120,(L23-120)/26*10,0) -> 0 | M24: =IF(M23>120,(M23-120)/26*10,0) -> 0 | N24: =IF(N23>120,(N23-120)/26*10,0) -> 0 | O24: =IF(O23>120,(O23-120)/26*10,0) -> 0 | P24: =IF(P23>120,(P23-120)/26*10,0) -> 0 | Q24: =IF(Q23>120,(Q23-120)/26*10,0) -> 0 | R24: =IF(R23>120,(R23-120)/26*10,0) -> 0 | S24: =IF(S23>120,(S23-120)/26*10,0) -> 0 | T24: =IF(T23>120,(T23-120)/26*10,0) -> 0 | U24: =IF(U23>120,(U23-120)/26*10,0) -> 0 | V24: =IF(V23>120,(V23-120)/26*10,0) -> 0 | W24: =IF(W23>120,(W23-120)/26*10,0) -> 0 | X24: =IF(X23>120,(X23-120)/26*10,0) -> 0 | Y24: =IF(Y23>120,(Y23-120)/26*10,0) -> 0 | Z24: =IF(Z23>120,(Z23-120)/26*10,0) -> 0 | AA24: =IF(AA23>120,(AA23-120)/26*10,0) -> 0 | AB24: =SUM(B24:AA24) -> 0.28846153846154943
A25: Little Jerry Seinfeld | B25: 117.85 | C25: 119.65 | D25: 119.65 | E25: 119.65 | F25: 119.65 | G25: 119.65 | H25: 119.95 | I25: 119.95 | J25: 119.95 | K25: 119.95 | L25: 119.95 | M25: 119.95 | N25: 119.95 | O25: 119.95 | P25: 119.95 | Q25: 119.95 | R25: 119.95 | S25: 119.95 | T25: 119.95 | U25: 119.95 | V25: 119.95 | W25: 119.95 | X25: 119.95 | Y25: 119.95 | Z25: 119.95 | AA25: 119.95 | AB25: =SUM(B25:AA25)/26 -> 119.81153846153842
B26: =IF(B25>120,(B25-120)/26*10,0) -> 0 | C26: =IF(C25>120,(C25-120)/26*10,0) -> 0 | D26: =IF(D25>120,(D25-120)/26*10,0) -> 0 | E26: =IF(E25>120,(E25-120)/26*10,0) -> 0 | F26: =IF(F25>120,(F25-120)/26*10,0) -> 0 | G26: =IF(G25>120,(G25-120)/26*10,0) -> 0 | H26: =IF(H25>120,(H25-120)/26*10,0) -> 0 | I26: =IF(I25>120,(I25-120)/26*10,0) -> 0 | J26: =IF(J25>120,(J25-120)/26*10,0) -> 0 | K26: =IF(K25>120,(K25-120)/26*10,0) -> 0 | L26: =IF(L25>120,(L25-120)/26*10,0) -> 0 | M26: =IF(M25>120,(M25-120)/26*10,0) -> 0 | N26: =IF(N25>120,(N25-120)/26*10,0) -> 0 | O26: =IF(O25>120,(O25-120)/26*10,0) -> 0 | P26: =IF(P25>120,(P25-120)/26*10,0) -> 0 | Q26: =IF(Q25>120,(Q25-120)/26*10,0) -> 0 | R26: =IF(R25>120,(R25-120)/26*10,0) -> 0 | S26: =IF(S25>120,(S25-120)/26*10,0) -> 0 | T26: =IF(T25>120,(T25-120)/26*10,0) -> 0 | U26: =IF(U25>120,(U25-120)/26*10,0) -> 0 | V26: =IF(V25>120,(V25-120)/26*10,0) -> 0 | W26: =IF(W25>120,(W25-120)/26*10,0) -> 0 | X26: =IF(X25>120,(X25-120)/26*10,0) -> 0 | Y26: =IF(Y25>120,(Y25-120)/26*10,0) -> 0 | Z26: =IF(Z25>120,(Z25-120)/26*10,0) -> 0 | AA26: =IF(AA25>120,(AA25-120)/26*10,0) -> 0 | AB26: =SUM(B26:AA26) -> 0
A27: Monroe County Cougars | B27: 128.35 | C27: 119.8 | D27: 119.8 | E27: 119.8 | F27: 119.8 | G27: 119.8 | H27: 119.8 | I27: 119.8 | J27: 119.8 | K27: 119.8 | L27: 119.8 | M27: 119.8 | N27: 119.8 | O27: 119.8 | P27: 119.8 | Q27: 119.8 | R27: 119.8 | S27: 119.8 | T27: 119.8 | U27: 119.8 | V27: 119.8 | W27: 119.8 | X27: 119.8 | Y27: 119.8 | Z27: 119.8 | AA27: 119.8 | AB27: =SUM(B27:AA27)/26 -> 120.12884615384618
B28: =IF(B27>120,(B27-120)/26*10,0) -> 3.2115384615384595 | C28: =IF(C27>120,(C27-120)/26*10,0) -> 0 | D28: =IF(D27>120,(D27-120)/26*10,0) -> 0 | E28: =IF(E27>120,(E27-120)/26*10,0) -> 0 | F28: =IF(F27>120,(F27-120)/26*10,0) -> 0 | G28: =IF(G27>120,(G27-120)/26*10,0) -> 0 | H28: =IF(H27>120,(H27-120)/26*10,0) -> 0 | I28: =IF(I27>120,(I27-120)/26*10,0) -> 0 | J28: =IF(J27>120,(J27-120)/26*10,0) -> 0 | K28: =IF(K27>120,(K27-120)/26*10,0) -> 0 | L28: =IF(L27>120,(L27-120)/26*10,0) -> 0 | M28: =IF(M27>120,(M27-120)/26*10,0) -> 0 | N28: =IF(N27>120,(N27-120)/26*10,0) -> 0 | O28: =IF(O27>120,(O27-120)/26*10,0) -> 0 | P28: =IF(P27>120,(P27-120)/26*10,0) -> 0 | Q28: =IF(Q27>120,(Q27-120)/26*10,0) -> 0 | R28: =IF(R27>120,(R27-120)/26*10,0) -> 0 | S28: =IF(S27>120,(S27-120)/26*10,0) -> 0 | T28: =IF(T27>120,(T27-120)/26*10,0) -> 0 | U28: =IF(U27>120,(U27-120)/26*10,0) -> 0 | V28: =IF(V27>120,(V27-120)/26*10,0) -> 0 | W28: =IF(W27>120,(W27-120)/26*10,0) -> 0 | X28: =IF(X27>120,(X27-120)/26*10,0) -> 0 | Y28: =IF(Y27>120,(Y27-120)/26*10,0) -> 0 | Z28: =IF(Z27>120,(Z27-120)/26*10,0) -> 0 | AA28: =IF(AA27>120,(AA27-120)/26*10,0) -> 0 | AB28: =SUM(B28:AA28) -> 3.2115384615384595
A29: Paul's Pounders | B29: 75.65 | C29: 75.65 | D29: 75.65 | E29: 75.65 | F29: 75.65 | G29: 75.65 | H29: 75.55 | I29: 75.55 | J29: 75.55 | K29: 75.55 | L29: 75.55 | M29: 75.55 | N29: 75.55 | O29: 75.55 | P29: 75.55 | Q29: 75.55 | R29: 75.55 | S29: 75.55 | T29: 75.55 | U29: 75.55 | V29: 75.55 | W29: 75.55 | X29: 75.55 | Y29: 75.55 | Z29: 75.55 | AA29: 75.55 | AB29: =SUM(B29:AA29)/26 -> 75.573076923076897
B30: =IF(B29>120,(B29-120)/26*10,0) -> 0 | C30: =IF(C29>120,(C29-120)/26*10,0) -> 0 | D30: =IF(D29>120,(D29-120)/26*10,0) -> 0 | E30: =IF(E29>120,(E29-120)/26*10,0) -> 0 | F30: =IF(F29>120,(F29-120)/26*10,0) -> 0 | G30: =IF(G29>120,(G29-120)/26*10,0) -> 0 | H30: =IF(H29>120,(H29-120)/26*10,0) -> 0 | I30: =IF(I29>120,(I29-120)/26*10,0) -> 0 | J30: =IF(J29>120,(J29-120)/26*10,0) -> 0 | K30: =IF(K29>120,(K29-120)/26*10,0) -> 0 | L30: =IF(L29>120,(L29-120)/26*10,0) -> 0 | M30: =IF(M29>120,(M29-120)/26*10,0) -> 0 | N30: =IF(N29>120,(N29-120)/26*10,0) -> 0 | O30: =IF(O29>120,(O29-120)/26*10,0) -> 0 | P30: =IF(P29>120,(P29-120)/26*10,0) -> 0 | Q30: =IF(Q29>120,(Q29-120)/26*10,0) -> 0 | R30: =IF(R29>120,(R29-120)/26*10,0) -> 0 | S30: =IF(S29>120,(S29-120)/26*10,0) -> 0 | T30: =IF(T29>120,(T29-120)/26*10,0) -> 0 | U30: =IF(U29>120,(U29-120)/26*10,0) -> 0 | V30: =IF(V29>120,(V29-120)/26*10,0) -> 0 | W30: =IF(W29>120,(W29-120)/26*10,0) -> 0 | X30: =IF(X29>120,(X29-120)/26*10,0) -> 0 | Y30: =IF(Y29>120,(Y29-120)/26*10,0) -> 0 | Z30: =IF(Z29>120,(Z29-120)/26*10,0) -> 0 | AA30: =IF(AA29>120,(AA29-120)/26*10,0) -> 0 | AB30: =SUM(B30:AA30) -> 0
A31: Philadelphia Bulldogs | B31: 136.75 | C31: 136.75 | D31: 136.75 | E31: 136.75 | F31: 136.75 | G31: 137.95 | H31: 138.2 | I31: 138.2 | J31: 138.2 | K31: 138.2 | L31: 138.2 | M31: 138.2 | N31: 138.2 | O31: 138.85 | P31: 139.6 | Q31: 139.6 | R31: 139 | S31: 139.35 | T31: 139.65 | U31: 139.65 | V31: 139.65 | W31: 139.65 | X31: 139.65 | Y31: 139.95 | Z31: 139.95 | AA31: 139.95 | AB31: =SUM(B31:AA31)/26 -> 138.6
B32: =IF(B31>120,(B31-120)/26*10,0) -> 6.4423076923076925 | C32: =IF(C31>120,(C31-120)/26*10,0) -> 6.4423076923076925 | D32: =IF(D31>120,(D31-120)/26*10,0) -> 6.4423076923076925 | E32: =IF(E31>120,(E31-120)/26*10,0) -> 6.4423076923076925 | F32: =IF(F31>120,(F31-120)/26*10,0) -> 6.4423076923076925 | G32: =IF(G31>120,(G31-120)/26*10,0) -> 6.9038461538461497 | H32: =IF(H31>120,(H31-120)/26*10,0) -> 6.9999999999999947 | I32: =IF(I31>120,(I31-120)/26*10,0) -> 6.9999999999999947 | J32: =IF(J31>120,(J31-120)/26*10,0) -> 6.9999999999999947 | K32: =IF(K31>120,(K31-120)/26*10,0) -> 6.9999999999999947 | L32: =IF(L31>120,(L31-120)/26*10,0) -> 6.9999999999999947 | M32: =IF(M31>120,(M31-120)/26*10,0) -> 6.9999999999999947 | N32: =IF(N31>120,(N31-120)/26*10,0) -> 6.9999999999999947 | O32: =IF(O31>120,(O31-120)/26*10,0) -> 7.25 | P32: =IF(P31>120,(P31-120)/26*10,0) -> 7.5384615384615365 | Q32: =IF(Q31>120,(Q31-120)/26*10,0) -> 7.5384615384615365 | R32: =IF(R31>120,(R31-120)/26*10,0) -> 7.3076923076923075 | S32: =IF(S31>120,(S31-120)/26*10,0) -> 7.4423076923076898 | T32: =IF(T31>120,(T31-120)/26*10,0) -> 7.5576923076923102 | U32: =IF(U31>120,(U31-120)/26*10,0) -> 7.5576923076923102 | V32: =IF(V31>120,(V31-120)/26*10,0) -> 7.5576923076923102 | W32: =IF(W31>120,(W31-120)/26*10,0) -> 7.5576923076923102 | X32: =IF(X31>120,(X31-120)/26*10,0) -> 7.5576923076923102 | Y32: =IF(Y31>120,(Y31-120)/26*10,0) -> 7.6730769230769189 | Z32: =IF(Z31>120,(Z31-120)/26*10,0) -> 7.6730769230769189 | AA32: =IF(AA31>120,(AA31-120)/26*10,0) -> 7.6730769230769189 | AB32: =SUM(B32:AA32) -> 186
A33: Raindogs | B33: 113 | C33: 114.25 | D33: 114.25 | E33: 115.5 | F33: 115.5 | G33: 116.7 | H33: 117.35 | I33: 117.35 | J33: 117.35 | K33: 117.35 | L33: 118.15 | M33: 118.15 | N33: 118.15 | O33: 118.15 | P33: 118.2 | Q33: 118.2 | R33: 118.2 | S33: 118.15 | T33: 118.15 | U33: 118.15 | V33: 118.15 | W33: 118.15 | X33: 118.15 | Y33: 118.15 | Z33: 118.15 | AA33: 118.15 | AB33: =SUM(B33:AA33)/26 -> 117.27500000000001
B34: =IF(B33>120,(B33-120)/26*10,0) -> 0 | C34: =IF(C33>120,(C33-120)/26*10,0) -> 0 | D34: =IF(D33>120,(D33-120)/26*10,0) -> 0 | E34: =IF(E33>120,(E33-120)/26*10,0) -> 0 | F34: =IF(F33>120,(F33-120)/26*10,0) -> 0 | G34: =IF(G33>120,(G33-120)/26*10,0) -> 0 | H34: =IF(H33>120,(H33-120)/26*10,0) -> 0 | I34: =IF(I33>120,(I33-120)/26*10,0) -> 0 | J34: =IF(J33>120,(J33-120)/26*10,0) -> 0 | K34: =IF(K33>120,(K33-120)/26*10,0) -> 0 | L34: =IF(L33>120,(L33-120)/26*10,0) -> 0 | M34: =IF(M33>120,(M33-120)/26*10,0) -> 0 | N34: =IF(N33>120,(N33-120)/26*10,0) -> 0 | O34: =IF(O33>120,(O33-120)/26*10,0) -> 0 | P34: =IF(P33>120,(P33-120)/26*10,0) -> 0 | Q34: =IF(Q33>120,(Q33-120)/26*10,0) -> 0 | R34: =IF(R33>120,(R33-120)/26*10,0) -> 0 | S34: =IF(S33>120,(S33-120)/26*10,0) -> 0 | T34: =IF(T33>120,(T33-120)/26*10,0) -> 0 | U34: =IF(U33>120,(U33-120)/26*10,0) -> 0 | V34: =IF(V33>120,(V33-120)/26*10,0) -> 0 | W34: =IF(W33>120,(W33-120)/26*10,0) -> 0 | X34: =IF(X33>120,(X33-120)/26*10,0) -> 0 | Y34: =IF(Y33>120,(Y33-120)/26*10,0) -> 0 | Z34: =IF(Z33>120,(Z33-120)/26*10,0) -> 0 | AA34: =IF(AA33>120,(AA33-120)/26*10,0) -> 0 | AB34: =SUM(B34:AA34) -> 0
A35: Steely Blues | B35: 119.95 | C35: 119.95 | D35: 119.95 | E35: 119.95 | F35: 119.95 | G35: 119.95 | H35: 119.95 | I35: 119.95 | J35: 118.8 | K35: 118.8 | L35: 118.8 | M35: 118.8 | N35: 118.8 | O35: 118.8 | P35: 118.8 | Q35: 118.8 | R35: 118.8 | S35: 118.8 | T35: 118.8 | U35: 118.8 | V35: 118.8 | W35: 118.8 | X35: 118.8 | Y35: 118.8 | Z35: 118.8 | AA35: 118.8 | AB35: =SUM(B35:AA35)/26 -> 119.1538461538462
B36: =IF(B35>120,(B35-120)/26*10,0) -> 0 | C36: =IF(C35>120,(C35-120)/26*10,0) -> 0 | D36: =IF(D35>120,(D35-120)/26*10,0) -> 0 | E36: =IF(E35>120,(E35-120)/26*10,0) -> 0 | F36: =IF(F35>120,(F35-120)/26*10,0) -> 0 | G36: =IF(G35>120,(G35-120)/26*10,0) -> 0 | H36: =IF(H35>120,(H35-120)/26*10,0) -> 0 | I36: =IF(I35>120,(I35-120)/26*10,0) -> 0 | J36: =IF(J35>120,(J35-120)/26*10,0) -> 0 | K36: =IF(K35>120,(K35-120)/26*10,0) -> 0 | L36: =IF(L35>120,(L35-120)/26*10,0) -> 0 | M36: =IF(M35>120,(M35-120)/26*10,0) -> 0 | N36: =IF(N35>120,(N35-120)/26*10,0) -> 0 | O36: =IF(O35>120,(O35-120)/26*10,0) -> 0 | P36: =IF(P35>120,(P35-120)/26*10,0) -> 0 | Q36: =IF(Q35>120,(Q35-120)/26*10,0) -> 0 | R36: =IF(R35>120,(R35-120)/26*10,0) -> 0 | S36: =IF(S35>120,(S35-120)/26*10,0) -> 0 | T36: =IF(T35>120,(T35-120)/26*10,0) -> 0 | U36: =IF(U35>120,(U35-120)/26*10,0) -> 0 | V36: =IF(V35>120,(V35-120)/26*10,0) -> 0 | W36: =IF(W35>120,(W35-120)/26*10,0) -> 0 | X36: =IF(X35>120,(X35-120)/26*10,0) -> 0 | Y36: =IF(Y35>120,(Y35-120)/26*10,0) -> 0 | Z36: =IF(Z35>120,(Z35-120)/26*10,0) -> 0 | AA36: =IF(AA35>120,(AA35-120)/26*10,0) -> 0 | AB36: =SUM(B36:AA36) -> 0
A37: The Fightin' Rats | B37: 119.55 | C37: 119.7 | D37: 119.7 | E37: 119.7 | F37: 119.7 | G37: 119.7 | H37: 119.7 | I37: 119.7 | J37: 120 | K37: 120.35 | L37: 118 | M37: 118 | N37: 118.35 | O37: 118.35 | P37: 118.35 | Q37: 118.35 | R37: 118.35 | S37: 118.35 | T37: 118.35 | U37: 118.35 | V37: 118.35 | W37: 118.35 | X37: 118.65 | Y37: 118.65 | Z37: 118.65 | AA37: 118.65 | AB37: =SUM(B37:AA37)/26 -> 118.91923076923075
B38: =IF(B37>120,(B37-120)/26*10,0) -> 0 | C38: =IF(C37>120,(C37-120)/26*10,0) -> 0 | D38: =IF(D37>120,(D37-120)/26*10,0) -> 0 | E38: =IF(E37>120,(E37-120)/26*10,0) -> 0 | F38: =IF(F37>120,(F37-120)/26*10,0) -> 0 | G38: =IF(G37>120,(G37-120)/26*10,0) -> 0 | H38: =IF(H37>120,(H37-120)/26*10,0) -> 0 | I38: =IF(I37>120,(I37-120)/26*10,0) -> 0 | J38: =IF(J37>120,(J37-120)/26*10,0) -> 0 | K38: =IF(K37>120,(K37-120)/26*10,0) -> 0.13461538461538244 | L38: =IF(L37>120,(L37-120)/26*10,0) -> 0 | M38: =IF(M37>120,(M37-120)/26*10,0) -> 0 | N38: =IF(N37>120,(N37-120)/26*10,0) -> 0 | O38: =IF(O37>120,(O37-120)/26*10,0) -> 0 | P38: =IF(P37>120,(P37-120)/26*10,0) -> 0 | Q38: =IF(Q37>120,(Q37-120)/26*10,0) -> 0 | R38: =IF(R37>120,(R37-120)/26*10,0) -> 0 | S38: =IF(S37>120,(S37-120)/26*10,0) -> 0 | T38: =IF(T37>120,(T37-120)/26*10,0) -> 0 | U38: =IF(U37>120,(U37-120)/26*10,0) -> 0 | V38: =IF(V37>120,(V37-120)/26*10,0) -> 0 | W38: =IF(W37>120,(W37-120)/26*10,0) -> 0 | X38: =IF(X37>120,(X37-120)/26*10,0) -> 0 | Y38: =IF(Y37>120,(Y37-120)/26*10,0) -> 0 | Z38: =IF(Z37>120,(Z37-120)/26*10,0) -> 0 | AA38: =IF(AA37>120,(AA37-120)/26*10,0) -> 0 | AB38: =SUM(B38:AA38) -> 0.13461538461538244
A39: The Mayhem 5 | B39: 79.35 | C39: 79.95 | D39: 79.95 | E39: 81.1 | F39: 81.1 | G39: 81.1 | H39: 83.8 | I39: 83.8 | J39: 83.8 | K39: 83.8 | L39: 84.25 | M39: 84.25 | N39: 84.25 | O39: 84.8 | P39: 84.8 | Q39: 84.8 | R39: 84.8 | S39: 84.8 | T39: 84.8 | U39: 84.8 | V39: 84.8 | W39: 84.8 | X39: 84.8 | Y39: 84.8 | Z39: 84.8 | AA39: 84.8 | AB39: =SUM(B39:AA39)/26 -> 83.573076923076911
B40: =IF(B39>120,(B39-120)/26*10,0) -> 0 | C40: =IF(C39>120,(C39-120)/26*10,0) -> 0 | D40: =IF(D39>120,(D39-120)/26*10,0) -> 0 | E40: =IF(E39>120,(E39-120)/26*10,0) -> 0 | F40: =IF(F39>120,(F39-120)/26*10,0) -> 0 | G40: =IF(G39>120,(G39-120)/26*10,0) -> 0 | H40: =IF(H39>120,(H39-120)/26*10,0) -> 0 | I40: =IF(I39>120,(I39-120)/26*10,0) -> 0 | J40: =IF(J39>120,(J39-120)/26*10,0) -> 0 | K40: =IF(K39>120,(K39-120)/26*10,0) -> 0 | L40: =IF(L39>120,(L39-120)/26*10,0) -> 0 | M40: =IF(M39>120,(M39-120)/26*10,0) -> 0 | N40: =IF(N39>120,(N39-120)/26*10,0) -> 0 | O40: =IF(O39>120,(O39-120)/26*10,0) -> 0 | P40: =IF(P39>120,(P39-120)/26*10,0) -> 0 | Q40: =IF(Q39>120,(Q39-120)/26*10,0) -> 0 | R40: =IF(R39>120,(R39-120)/26*10,0) -> 0 | S40: =IF(S39>120,(S39-120)/26*10,0) -> 0 | T40: =IF(T39>120,(T39-120)/26*10,0) -> 0 | U40: =IF(U39>120,(U39-120)/26*10,0) -> 0 | V40: =IF(V39>120,(V39-120)/26*10,0) -> 0 | W40: =IF(W39>120,(W39-120)/26*10,0) -> 0 | X40: =IF(X39>120,(X39-120)/26*10,0) -> 0 | Y40: =IF(Y39>120,(Y39-120)/26*10,0) -> 0 | Z40: =IF(Z39>120,(Z39-120)/26*10,0) -> 0 | AA40: =IF(AA39>120,(AA39-120)/26*10,0) -> 0 | AB40: =SUM(B40:AA40) -> 0
A41: The Unsullied | B41: 39.2 | C41: 40.4 | D41: 40.4 | E41: 40.4 | F41: 40.4 | G41: 40.4 | H41: 40.4 | I41: 40.4 | J41: 40.4 | K41: 40.4 | L41: 40.4 | M41: 40.4 | N41: 40.4 | O41: 41 | P41: 41 | Q41: 41 | R41: 41 | S41: 41 | T41: 41 | U41: 41 | V41: 41 | W41: 41 | X41: 41 | Y41: 41 | Z41: 41 | AA41: 41 | AB41: =SUM(B41:AA41)/26 -> 40.653846153846153
B42: =IF(B41>120,(B41-120)/26*10,0) -> 0 | C42: =IF(C41>120,(C41-120)/26*10,0) -> 0 | D42: =IF(D41>120,(D41-120)/26*10,0) -> 0 | E42: =IF(E41>120,(E41-120)/26*10,0) -> 0 | F42: =IF(F41>120,(F41-120)/26*10,0) -> 0 | G42: =IF(G41>120,(G41-120)/26*10,0) -> 0 | H42: =IF(H41>120,(H41-120)/26*10,0) -> 0 | I42: =IF(I41>120,(I41-120)/26*10,0) -> 0 | J42: =IF(J41>120,(J41-120)/26*10,0) -> 0 | K42: =IF(K41>120,(K41-120)/26*10,0) -> 0 | L42: =IF(L41>120,(L41-120)/26*10,0) -> 0 | M42: =IF(M41>120,(M41-120)/26*10,0) -> 0 | N42: =IF(N41>120,(N41-120)/26*10,0) -> 0 | O42: =IF(O41>120,(O41-120)/26*10,0) -> 0 | P42: =IF(P41>120,(P41-120)/26*10,0) -> 0 | Q42: =IF(Q41>120,(Q41-120)/26*10,0) -> 0 | R42: =IF(R41>120,(R41-120)/26*10,0) -> 0 | S42: =IF(S41>120,(S41-120)/26*10,0) -> 0 | T42: =IF(T41>120,(T41-120)/26*10,0) -> 0 | U42: =IF(U41>120,(U41-120)/26*10,0) -> 0 | V42: =IF(V41>120,(V41-120)/26*10,0) -> 0 | W42: =IF(W41>120,(W41-120)/26*10,0) -> 0 | X42: =IF(X41>120,(X41-120)/26*10,0) -> 0 | Y42: =IF(Y41>120,(Y41-120)/26*10,0) -> 0 | Z42: =IF(Z41>120,(Z41-120)/26*10,0) -> 0 | AA42: =IF(AA41>120,(AA41-120)/26*10,0) -> 0 | AB42: =SUM(B42:AA42) -> 0
A44: Payroll | B44: =SUM(B3,B5,B7,B9,B11,B13,B15,B17,B19,B21,B23,B25,B27,B29,B31,B33,B35,B37,B39,B41) -> 2167.95 | C44: =SUM(C3,C5,C7,C9,C11,C13,C15,C17,C19,C21,C23,C25,C27,C29,C31,C33,C35,C37,C39,C41) -> 2173.1 | D44: =SUM(D3,D5,D7,D9,D11,D13,D15,D17,D19,D21,D23,D25,D27,D29,D31,D33,D35,D37,D39,D41) -> 2174.5 | E44: =SUM(E3,E5,E7,E9,E11,E13,E15,E17,E19,E21,E23,E25,E27,E29,E31,E33,E35,E37,E39,E41) -> 2177.25 | F44: =SUM(F3,F5,F7,F9,F11,F13,F15,F17,F19,F21,F23,F25,F27,F29,F31,F33,F35,F37,F39,F41) -> 2177.25 | G44: =SUM(G3,G5,G7,G9,G11,G13,G15,G17,G19,G21,G23,G25,G27,G29,G31,G33,G35,G37,G39,G41) -> 2180.55 | H44: =SUM(H3,H5,H7,H9,H11,H13,H15,H17,H19,H21,H23,H25,H27,H29,H31,H33,H35,H37,H39,H41) -> 2183.5 | I44: =SUM(I3,I5,I7,I9,I11,I13,I15,I17,I19,I21,I23,I25,I27,I29,I31,I33,I35,I37,I39,I41) -> 2183.5 | J44: =SUM(J3,J5,J7,J9,J11,J13,J15,J17,J19,J21,J23,J25,J27,J29,J31,J33,J35,J37,J39,J41) -> 2186.3 | K44: =SUM(K3,K5,K7,K9,K11,K13,K15,K17,K19,K21,K23,K25,K27,K29,K31,K33,K35,K37,K39,K41) -> 2186.95 | L44: =SUM(L3,L5,L7,L9,L11,L13,L15,L17,L19,L21,L23,L25,L27,L29,L31,L33,L35,L37,L39,L41) -> 2191.35 | M44: =SUM(M3,M5,M7,M9,M11,M13,M15,M17,M19,M21,M23,M25,M27,M29,M31,M33,M35,M37,M39,M41) -> 2191.35 | N44: =SUM(N3,N5,N7,N9,N11,N13,N15,N17,N19,N21,N23,N25,N27,N29,N31,N33,N35,N37,N39,N41) -> 2192.6 | O44: =SUM(O3,O5,O7,O9,O11,O13,O15,O17,O19,O21,O23,O25,O27,O29,O31,O33,O35,O37,O39,O41) -> 2194.55 | P44: =SUM(P3,P5,P7,P9,P11,P13,P15,P17,P19,P21,P23,P25,P27,P29,P31,P33,P35,P37,P39,P41) -> 2194.55 | Q44: =SUM(Q3,Q5,Q7,Q9,Q11,Q13,Q15,Q17,Q19,Q21,Q23,Q25,Q27,Q29,Q31,Q33,Q35,Q37,Q39,Q41) -> 2194.55 | R44: =SUM(R3,R5,R7,R9,R11,R13,R15,R17,R19,R21,R23,R25,R27,R29,R31,R33,R35,R37,R39,R41) -> 2197.65 | S44: =SUM(S3,S5,S7,S9,S11,S13,S15,S17,S19,S21,S23,S25,S27,S29,S31,S33,S35,S37,S39,S41) -> 2198.55 | T44: =SUM(T3,T5,T7,T9,T11,T13,T15,T17,T19,T21,T23,T25,T27,T29,T31,T33,T35,T37,T39,T41) -> 2198.85 | U44: =SUM(U3,U5,U7,U9,U11,U13,U15,U17,U19,U21,U23,U25,U27,U29,U31,U33,U35,U37,U39,U41) -> 2198.85 | V44: =SUM(V3,V5,V7,V9,V11,V13,V15,V17,V19,V21,V23,V25,V27,V29,V31,V33,V35,V37,V39,V41) -> 2198.85 | W44: =SUM(W3,W5,W7,W9,W11,W13,W15,W17,W19,W21,W23,W25,W27,W29,W31,W33,W35,W37,W39,W41) -> 2199.45 | X44: =SUM(X3,X5,X7,X9,X11,X13,X15,X17,X19,X21,X23,X25,X27,X29,X31,X33,X35,X37,X39,X41) -> 2200.05 | Y44: =SUM(Y3,Y5,Y7,Y9,Y11,Y13,Y15,Y17,Y19,Y21,Y23,Y25,Y27,Y29,Y31,Y33,Y35,Y37,Y39,Y41) -> 2202.75 | Z44: =SUM(Z3,Z5,Z7,Z9,Z11,Z13,Z15,Z17,Z19,Z21,Z23,Z25,Z27,Z29,Z31,Z33,Z35,Z37,Z39,Z41) -> 2202.75 | AA44: =SUM(AA3,AA5,AA7,AA9,AA11,AA13,AA15,AA17,AA19,AA21,AA23,AA25,AA27,AA29,AA31,AA33,AA35,AA37,AA39,AA41) -> 2202.75 | AB44: =SUM(AB3,AB5,AB7,AB9,AB11,AB13,AB15,AB17,AB19,AB21,AB23,AB25,AB27,AB29,AB31,AB33,AB35,AB37,AB39,AB41) -> 2190.3961538461535
A45: Taxes | B45: =SUM(B4,B6,B8,B10,B12,B14,B16,B18,B20,B22,B24,B26,B28,B30,B32,B34,B36,B38,B40,B42) -> 10.115384615384615 | C45: =SUM(C4,C6,C8,C10,C12,C14,C16,C18,C20,C22,C24,C26,C28,C30,C32,C34,C36,C38,C40,C42) -> 6.5 | D45: =SUM(D4,D6,D8,D10,D12,D14,D16,D18,D20,D22,D24,D26,D28,D30,D32,D34,D36,D38,D40,D42) -> 6.7307692307692308 | E45: =SUM(E4,E6,E8,E10,E12,E14,E16,E18,E20,E22,E24,E26,E28,E30,E32,E34,E36,E38,E40,E42) -> 6.5 | F45: =SUM(F4,F6,F8,F10,F12,F14,F16,F18,F20,F22,F24,F26,F28,F30,F32,F34,F36,F38,F40,F42) -> 6.5 | G45: =SUM(G4,G6,G8,G10,G12,G14,G16,G18,G20,G22,G24,G26,G28,G30,G32,G34,G36,G38,G40,G42) -> 6.9038461538461497 | H45: =SUM(H4,H6,H8,H10,H12,H14,H16,H18,H20,H22,H24,H26,H28,H30,H32,H34,H36,H38,H40,H42) -> 6.9999999999999947 | I45: =SUM(I4,I6,I8,I10,I12,I14,I16,I18,I20,I22,I24,I26,I28,I30,I32,I34,I36,I38,I40,I42) -> 6.9999999999999947 | J45: =SUM(J4,J6,J8,J10,J12,J14,J16,J18,J20,J22,J24,J26,J28,J30,J32,J34,J36,J38,J40,J42) -> 6.9999999999999947 | K45: =SUM(K4,K6,K8,K10,K12,K14,K16,K18,K20,K22,K24,K26,K28,K30,K32,K34,K36,K38,K40,K42) -> 8.2884615384615312 | L45: =SUM(L4,L6,L8,L10,L12,L14,L16,L18,L20,L22,L24,L26,L28,L30,L32,L34,L36,L38,L40,L42) -> 8.153846153846148 | M45: =SUM(M4,M6,M8,M10,M12,M14,M16,M18,M20,M22,M24,M26,M28,M30,M32,M34,M36,M38,M40,M42) -> 8.153846153846148 | N45: =SUM(N4,N6,N8,N10,N12,N14,N16,N18,N20,N22,N24,N26,N28,N30,N32,N34,N36,N38,N40,N42) -> 8.153846153846148 | O45: =SUM(O4,O6,O8,O10,O12,O14,O16,O18,O20,O22,O24,O26,O28,O30,O32,O34,O36,O38,O40,O42) -> 8.4038461538461515 | P45: =SUM(P4,P6,P8,P10,P12,P14,P16,P18,P20,P22,P24,P26,P28,P30,P32,P34,P36,P38,P40,P42) -> 8.3846153846153832 | Q45: =SUM(Q4,Q6,Q8,Q10,Q12,Q14,Q16,Q18,Q20,Q22,Q24,Q26,Q28,Q30,Q32,Q34,Q36,Q38,Q40,Q42) -> 8.3846153846153832 | R45: =SUM(R4,R6,R8,R10,R12,R14,R16,R18,R20,R22,R24,R26,R28,R30,R32,R34,R36,R38,R40,R42) -> 8.1538461538461551 | S45: =SUM(S4,S6,S8,S10,S12,S14,S16,S18,S20,S22,S24,S26,S28,S30,S32,S34,S36,S38,S40,S42) -> 8.2884615384615365 | T45: =SUM(T4,T6,T8,T10,T12,T14,T16,T18,T20,T22,T24,T26,T28,T30,T32,T34,T36,T38,T40,T42) -> 8.4038461538461569 | U45: =SUM(U4,U6,U8,U10,U12,U14,U16,U18,U20,U22,U24,U26,U28,U30,U32,U34,U36,U38,U40,U42) -> 8.4038461538461569 | V45: =SUM(V4,V6,V8,V10,V12,V14,V16,V18,V20,V22,V24,V26,V28,V30,V32,V34,V36,V38,V40,V42) -> 8.4038461538461569 | W45: =SUM(W4,W6,W8,W10,W12,W14,W16,W18,W20,W22,W24,W26,W28,W30,W32,W34,W36,W38,W40,W42) -> 8.4038461538461569 | X45: =SUM(X4,X6,X8,X10,X12,X14,X16,X18,X20,X22,X24,X26,X28,X30,X32,X34,X36,X38,X40,X42) -> 8.4038461538461569 | Y45: =SUM(Y4,Y6,Y8,Y10,Y12,Y14,Y16,Y18,Y20,Y22,Y24,Y26,Y28,Y30,Y32,Y34,Y36,Y38,Y40,Y42) -> 8.5192307692307665 | Z45: =SUM(Z4,Z6,Z8,Z10,Z12,Z14,Z16,Z18,Z20,Z22,Z24,Z26,Z28,Z30,Z32,Z34,Z36,Z38,Z40,Z42) -> 8.5192307692307665 | AA45: =SUM(AA4,AA6,AA8,AA10,AA12,AA14,AA16,AA18,AA20,AA22,AA24,AA26,AA28,AA30,AA32,AA34,AA36,AA38,AA40,AA42) -> 8.5192307692307665 | AB45: =SUM(AB4,AB6,AB8,AB10,AB12,AB14,AB16,AB18,AB20,AB22,AB24,AB26,AB28,AB30,AB32,AB34,AB36,AB38,AB40,AB42) -> 206.19230769230768